name,state,city,address,latitude,longitude,Charging Type,Supported Vehicle Types,access hours,Pricing Information,Amenities
Tata Power Electric Vehicle Charging station Gennext Motors,Andaman and Nicobar Islands,Port Blair,"Pahargaon, Ground Floor New, Port Blair, South Andaman District, Andaman & Nicobar Islands, 744103",11.63086575,92.72462903,DC Fast Charging,EV2,24-Jul,?10 k/Wh,"Wifi, Parking"
Sri Murugan Stores,Tamil Nadu,chennai,"9&10, Tejraj colony, Agaram Main Rd, Selaiyur, Chennai, Tamil Nadu ",12.9056714,80.1421391,AC Fast Charging,EV1,24-Jul,?8 k/Wh,"Wifi, Parking"
"Nandi Food Plaza, Nalagam palli",Andhra Pradesh,Chittoor,"NH 69 - 174 Nalagampalli Chittoor-Bangalore Highway Close to Bangarupalem, Village, Nalagam palli, Andhra Pradesh 517416",13.2035919,78.9415658,AC Fast Charging,EV1,24-Jul,?9 k/Wh,Wifi
"Highway Grand World, Chennai-Tirupati Highway NH 716",Andhra Pradesh,Tirupati,"Chennai - Thiruttani - Renigunta Hwy, NH716 - Veerakaverirajupuram, Andhra Pradesh, Nagari, Andhra Pradesh 517590",13.29360934,79.58170947,DC Fast Charging,EV2,24-Jul,?7 k/Wh,"Wifi, Parking"
Ather Grid Charging Station,Andhra Pradesh,Tirupati,"Hindustan Petroleum,P Kothakota, Chavatapalli, Chittoor, NH-18A, Chittoor - Tirupati Rd, Tirupati, Andhra Pradesh 517124",13.39610918,79.09955078,DC Fast Charging,EV2,24-Jul,?10 k/Wh,Parking
"IOCL - KOORAPATI SERVICE STATION, Tirupati",Andhra Pradesh,Tirupati,"TIRUPATI URBAN AND MANDAL Air bye-pass road. Tirupati, Chittoor-517502",13.6207096,79.3828146,AC Fast Charging,EV1,24-Jul,?8 k/Wh,Parking
Hotel Bliss | Tirupati,Andhra Pradesh,Tirupathi,"Hotel Bliss, 19-3-45, Near Ramanuja Circle, Renigunta Rd, Tirupati, Andhra Pradesh 517501",13.6253731,79.4322333,DC Fast Charging,EV2,24-Jul,?9 k/Wh,"Wifi, Parking"
Bhimas Residency Hotel ,Andhra Pradesh,Tirupati,"19-3-41 Renigunta Road, near Ramanuja Circle",13.62754649,79.43056383,AC Fast Charging,EV1,24-Jul,?8 k/Wh,"No Wifi, No Parking"
"PNR Function Hall, Chennai-Ballary Highway",Andhra Pradesh,Proddatur,"D No 7/3109 Sy No 622, Beside IOCL petrol pump, Korrapadu Road, Andhrakesari Nagar, Proddatur Municipality, Andhra Pradesh 516360 ",14.7529922,78.5550768,AC Fast Charging,EV1,24-Jul,?7 k/Wh,"Wifi, Parking"
"Blue Moon Highway Restaurant, Bangalore-Hyderabad Highway",Andhra Pradesh,Anantapuram,"NH 44; Bangalore - Hyderabad  highway, 116/1B, Midthuru, Peddavaduguru, Anantapuram, Andhra Pradesh 515405",15.02395,77.620628,DC Fast Charging,EV2,24-Jul,?10 k/Wh,"No Wifi, No Parking"
"IOCL - Sai Krupa Filling Station, SH 26",Andhra Pradesh,Anantapur,"SH 26, Vajrakarur to Guntakal Road SURVEY No.401-AIu00e2u0080u008b, Anantapur Dist. ANDHRA PRADESH,515722",15.1462972,77.3774561,AC Fast Charging,EV1,24-Jul,?9 k/Wh,Wifi
"Matsya Amazon Kitchens, Kurnool Rd",Andhra Pradesh,Kurnool,"NH 44; Bangalore - Hyderabad  highway, Kurnool Rd, Andhra Pradesh 518216",15.576915,77.93704,DC Fast Charging,EV2,24-Jul,?8 k/Wh,Parking
"Aavas Hotels & Resorts, NH 16 Velampalli",Andhra Pradesh,Ongole,"Aavas Hotel Resort, NH16, Vellampalli, Andhra Pradesh 523211",15.64863954,80.02711554,AC Fast Charging,EV1,24-Jul,?8 k/Wh,"Wifi, Parking"
"Sasya Auto Cars, Bellari X Roads - NH 44",Andhra Pradesh,Kurnool,"Renault Showroom, 45/142-70-5-B, NH44 Near APSP 2nd Battallion, Bellari X Roads, Kurnool, Andhra Pradesh 518003",15.8305662,78.0179892,DC Fast Charging,EV2,24-Jul,?7 k/Wh,Parking
"Sasya Automotives, Near EENADU Office - NH 44",Andhra Pradesh,Kurnool,"Isuzu Showroom, Survey No-131-1 & 133-1A NH44 Near EENADU Office, Kurnool, Andhra Pradesh 518003",15.8498643,78.0045003,AC Fast Charging,EV1,24-Jul,?8 k/Wh,"Wifi, Parking"
"Jayalakshmi Auto, Gudavalli",Andhra Pradesh,Vijayawada,"Jayalakshmi Auto Enterprises Pvt Ltd, Survey no 3/142 , Gudavalli Junction, Vijayawada rural, Krishna District ,521104",16.5129225,80.7497565,AC Fast Charging,EV1,24-Jul,?9 k/Wh,"No Wifi, No Parking"
"Hotel Grand Leela Krishna, Bhimavaram",Andhra Pradesh,Bhimavaram,"Undi Rd, Balusumoodi, Bhimavaram, Andhra Pradesh 534202",16.5451748,81.5199403,DC Fast Charging,EV2,24-Jul,?7 k/Wh,Wifi
"IOCL - NAVABHARAGAVA FILLING STATION, Vijayawada - Hyderabad Hwy",Andhra Pradesh,Vijayawada,"Vijayawada - Hyderabad Hwy, Ibrahimpatnam, Andhra Pradesh 521456",16.5812639,80.5263493,AC Fast Charging,EV1,24-Jul,?8 k/Wh,"No Wifi, No Parking"
"Garuda Food Court, Komirepalle",Andhra Pradesh,Komirepalle,"NH 16 Gundugolanu, Komirepalle, Andhra Pradesh 534427",16.778579,81.221054,DC Fast Charging,EV2,24-Jul,?9 k/Wh,Wifi
"River Bay Resorts, Gautami Ghat",Andhra Pradesh,Rajahmundry,"Hotel River Bay Resort, 5-1-36 to 43 Gautami Ghat, Rajahmundry-533101",16.9921196,81.7735774,AC Fast Charging,EV1,24-Jul,?8 k/Wh,Wifi
IOCL - TIRUMALA AGENCIES,Andhra Pradesh,Peddapuram,"Sy No 164, Peddapuram Bye-Pass Village/Mandal, East Godavari-533437",17.0758862,82.1217314,AC Fast Charging,EV1,24-Jul,?8 k/Wh,"No Wifi, No Parking"
"IOCL Sree Devi Prasad Services, Naamavaram",Andhra Pradesh,Naamavaram,"Naamavaram, Andhra Pradesh 531126",17.3736805,82.5862594,AC Fast Charging,EV1,24-Jul,?7 k/Wh,Parking
"Shiv Shanker Motors, Gajuwaka",Andhra Pradesh,Vizag,"Sobha Square, Vishwaswaraya Nagar, Gajuwaka, Vishakhapatanam-530012",17.68429,83.185923,DC Fast Charging,EV2,24-Jul,?9 k/Wh,"Wifi, Parking"
"Daspalla Hotels, Suryabagh",Andhra Pradesh,Vizag,"Hotel Daspalla Visakhapatnam, 28-2-48, Suryabagh, Jagadamba Junction,A P 530020",17.7105539,83.3008275,AC Fast Charging,EV1,24-Jul,?8 k/Wh,"Wifi, Parking"
"Tristar Auto Agencies, RK Beach Junction",Andhra Pradesh,Vizag,"Beside Kali Matha Mandhir, RK Beach Junction, Visakhapatnam-530002",17.71241304,83.3184811,DC Fast Charging,EV2,24-Jul,?10 k/Wh,Wifi
"Croma u00e2u0080u0093 MVR Complex, Waltair Uplands",Andhra Pradesh,Vizag,"Ground & First floor, MVR # 10-1-39/B&C, Siripuram Cir, opp. Rock Park, Waltair Uplands, Visakhapatnam, Andhra Pradesh 530003",17.725417,83.315175,AC Fast Charging,EV1,24-Jul,?9 k/Wh,"Wifi, Parking"
"Shiv Shanker Motors, Kancharpalem",Andhra Pradesh,Vizag,"C 24, Industrail Estate, Kancharapalem, Vishakhapatnam u00e2u0080u0093 530010",17.738719,83.26258,DC Fast Charging,EV2,24-Jul,?7 k/Wh,Parking
Abhay Graphics II,Maharashtra,pune,"D-II, Plot no 32, Unit B - Near Kia Showroom, In front of HDFC Colony, Chinchwad",18.65324253,73.80340133,DC Fast Charging,EV2,24-Jul,?8 k/Wh,Wifi
Nukkad Tea Cafe,Chhattisgarh,raipur,"75, Jalvihar Colony Rd, Civil Lines, Raipur, Chhattisgarh",21.2404762,81.6574975,AC Fast Charging,EV1,24-Jul,?10 k/Wh,"No Wifi, No Parking"
Ardas Televentures Pvt Ltd,Rajasthan,jaipur,"#147, Rathore Nagar, Amrapali Road, Vaishali Nagar",26.911545,75.74876,AC Fast Charging,EV1,24-Jul,?9 k/Wh,Wifi
Hotel Parktel ,Uttar Pradesh,ghaziabad,"Omaxe Plaza, 583, Vijay Laxmi Pandit Marg, Near, Shakti Khand 2, Indirapuram, Ghaziabad, Uttar Pradesh",28.6463665,77.36784004,DC Fast Charging,EV2,24-Jul,?8 k/Wh,"Wifi, Parking"
Hotel JAS,Andhra Pradesh ,Visakhapatnam,"NH45 Kagitha Village Near Vempadu Toll Gate Nakkapalli, Mandalam, Visakhapatnam",17.39957297,82.68113802,DC Fast Charging,EV2,24-Jul,?9 k/Wh,"No Wifi, No Parking"
"E Planet, Thalassery",Kerala,kannur,"AVK Nair Road, Pilakool, Thalassery, Kerala ",11.74554436,75.4950197,AC Fast Charging,EV1,24-Jul,?7 k/Wh,Parking
M R A Restaurant,Kerala,kannur,"Kasaragod - Kannur Rd, Trichambaram, Taliparamba, Kerala ",12.02562662,75.36717734,DC Fast Charging,EV2,24-Jul,?10 k/Wh,"No Wifi, No Parking"
"Radisson Resort, ECR",Tamil Nadu,chennai,ECR,12.6238102,80.1947665,DC Fast Charging,EV2,24-Jul,?8 k/Wh,Wifi
"Nandi Food Plaza, Nalagam palli",Andhra Pradesh,Chittoor,"NH 69 - 174 Nalagampalli Chittoor-Bangalore Highway Close to Bangarupalem, Village, Nalagam palli, Andhra Pradesh 517416",13.2035919,78.9415658,AC Fast Charging,EV1,24-Jul,?9 k/Wh,"Wifi, Parking"
"Highway Grand World, Chennai-Tirupati Highway NH 716",Andhra Pradesh,Tirupati,"Chennai - Thiruttani - Renigunta Hwy, NH716 - Veerakaverirajupuram, Andhra Pradesh, Nagari, Andhra Pradesh 517590",13.29360934,79.58170947,DC Fast Charging,EV2,24-Jul,?10 k/Wh,Wifi
"IOCL - KOORAPATI SERVICE STATION, Tirupati",Andhra Pradesh,Tirupati,"TIRUPATI URBAN AND MANDAL Air bye-pass road. Tirupati, Chittoor Dist ANDHRA PRADESH",13.6207096,79.3828146,AC Fast Charging,EV1,24-Jul,?8 k/Wh,Parking
Bhimas Residency Hotel ,Andhra Pradesh,Tirupati,"19-3-41 Renigunta Road, near Ramanuja Circle",13.62754649,79.43056383,DC Fast Charging,EV2,24-Jul,?10 k/Wh ,"Wifi, Parking"
"PNR Function Hall, Chennai-Ballary Highway",Andhra Pradesh,Proddatur,"D No 7/3109 Sy No 622, Beside IOCL petrol pump, Korrapadu Road, Andhrakesari Nagar, Proddatur Municipality, Andhra Pradesh 516360 ",14.7529922,78.5550768,AC Fast Charging,EV1,24-Jul,?8 k/Wh,"Wifi, Parking"
"Blue Moon Highway Restaurant, Bangalore-Hyderabad Highway",Andhra Pradesh,Anantapuram,"NH 44; Bangalore - Hyderabad  highway, 116/1B, Midthuru, Peddavaduguru, Anantapuram, Andhra Pradesh 515405",15.02395,77.620628,DC Fast Charging,EV2,24-Jul,?10 k/Wh,"Wifi, Parking"
"IOCL - Sai Krupa Filling Station, SH 26",Andhra Pradesh,Anantapur,"SH 26, Vajrakarur to Guntakal Road SURVEY No.401-AIu00e2u0080u008b, Anantapur Dist. ANDHRA PRADESH,515722",15.1462972,77.3774561,AC Fast Charging,EV1,24-Jul,?7 k/Wh,Parking
"Matsya Amazon Kitchens, Kurnool Rd",Andhra Pradesh,Kurnool,"NH 44; Bangalore - Hyderabad  highway, Kurnool Rd, Andhra Pradesh 518216",15.576915,77.93704,AC Fast Charging,EV1,24-Jul,?9 k/Wh,Wifi
"Sasya Auto Cars, Bellari X Roads - NH 44",Andhra Pradesh,Kurnool,"Renault Showroom, 45/142-70-5-B, NH44 Near APSP 2nd Battallion, Bellari X Roads, Kurnool, Andhra Pradesh 518003",15.8305662,78.0179892,DC Fast Charging,EV2,24-Jul,?8 k/Wh,Parking
"Sasya Automotives, Near EENADU Office - NH 44",Andhra Pradesh,Kurnool,"Isuzu Showroom, Survey No-131-1 & 133-1A NH44 Near EENADU Office, Kurnool, Andhra Pradesh 518003",15.8498643,78.0045003,AC Fast Charging,EV1,24-Jul,?8 k/Wh,Wifi
"IOCL - NAVABHARAGAVA FILLING STATION, Vijayawada - Hyderabad Hwy",Andhra Pradesh,Vijayawada,"Vijayawada - Hyderabad Hwy, Ibrahimpatnam, Andhra Pradesh 521456",16.5812639,80.5263493,DC Fast Charging,EV2,24-Jul,?9 k/Wh,"Wifi, Parking"
Akki's Bistro,Maharashtra,kolhapur,"CS No 1082, Chandrameela Building, Near Krishna temple, Mohite park, Kolhapur, Maharashtra 416012",16.6856931,74.2084223,AC Fast Charging,EV1,24-Jul,?8 k/Wh,Wifi
"River Bay Resorts, Gautami Ghat",Andhra Pradesh,Rajahmundry,"Hotel River Bay Resort, 5-1-36 to 43 Gautami Ghat, Rajahmundry-533101",16.9921196,81.7735774,DC Fast Charging,EV2,24-Jul,?10 k/Wh,"Wifi, Parking"
"IOCL Sree Devi Prasad Services, Naamavaram",Andhra Pradesh,Naamavaram,"Naamavaram, Andhra Pradesh 531126",17.3736805,82.5862594,AC Fast Charging,EV1,24-Jul,?7 k/Wh,"No Wifi, No Parking"
Hotel JAS,Andhra pradesh,Visakhapatnam,"NH45 Kagitha Village Near Vempadu Toll Gate Nakkapalli, Mandalam, Visakhapatnam",17.39957297,82.68113802,DC Fast Charging,EV2,24-Jul,?9 k/Wh,"Wifi, Parking"
"Tristar Auto Agencies, RK Beach Junction",Andhra Pradesh,Vizag,"Beside Kali Matha Mandhir, RK Beach Junction, Visakhapatnam-530002",17.71241304,83.3184811,AC Fast Charging,EV1,24-Jul,?8 k/Wh,Wifi
The Coffee Stories,Maharashtra,pune,"2, Meher classic, shop no:2, opp N.K.Ashiyana society, Marketyard, pune, near unity bakers, Pune, Maharashtra ",18.48792254,73.8727627,DC Fast Charging,EV2,24-Jul,?12 k/Wh,"Wifi, Parking"
Oyo Soho,Uttar Pradesh,noida,"D-141, Block D, Sector 51, Noida, Uttar Pradesh 201301",28.58066,77.37497,AC Fast Charging,EV1,24-Jul,?8 k/Wh,"No Wifi, No Parking"
TamTree,Maharashtra,pune,"Shop No.5, Pragati Bhavan, Behind Natural Ice Cream shop, Ghole Rd, near Bal Gandharva Chowk, Shivajinagar, Pune, Maharashtra ",18.5231567,73.8476929,AC Fast Charging,EV1,24-Jul,?9 k/Wh,"Wifi, Parking"
Hotel Gangothri,Andra Pradesh,Kodikonda,"Kodikonda Checkpost (V), Chilamathur (Mandal), Anantapur Andhra pradesh 515601",13.83,77.74,DC Fast Charging,EV2,24-Jul,?7 k/Wh,Wifi
Exotikka Restaurant,Andra Pradesh,Ananthapur,"survey no- 155, NH44, beside TATA show room. Kakkala palli village Anantapur 515001.",14.65,77.58,AC Fast Charging,EV1,24-Jul,?8 k/Wh,Wifi
"Ashutosh Motors, Lokhra",Assam,Guwahati,"NH-37, Chariali, Lokhra, Guwahati, Assam 781028",26.111365,91.746149,DC Fast Charging,EV2,24-Jul,?8 k/Wh,"Wifi, Parking"
"Sarawgi Motors, Saukuchi",Assam,Guwahati,"Sarusajai Stadium Garalia NH 37, Basistha, Saukuchi, near National Games Stadium, Assam 781040",26.111877,91.759799,AC Fast Charging,EV1,24-Jul,?9 k/Wh,Wifi
Tata Power ,Assam,Guwahati,"Ginger Hotel, Borbari, Ginger Hotel GuwahatiI HM Campus, VIP Road, Upper Hengrabari, Borbari, Guwahati 781036",26.1474785,91.8145291,DC Fast Charging,EV2,24-Jul,?10 k/Wh,Wifi
"Utkarsh Mototech, Assam Trunk Rd",Assam,Guwahati,"Kamakhya Gate, Swastik Ayodhya Complex, Assam Trunk Rd, Guwahati, Assam 781009",26.164406,91.715516,AC Fast Charging,EV1,24-Jul,?7 k/Wh,"No Wifi, No Parking"
"Ashutosh Motors, near NHPC Godown",Assam,Nagaon,"Biroh Bebejia Sensowa, near NHPC Godown, Nagaon, Assam 782002",26.3123315,92.6401864,DC Fast Charging,EV2,24-Jul,?8 k/Wh,Wifi
"Pragati Trading, NH 37",Assam,Jorhat,"NH37, Jorhat, Assam 785006",26.7470487,94.1680718,AC Fast Charging,EV1,24-Jul,?8 k/Wh,Wifi
"DN Regalia Mall, Patrapada",Odisha,Bhubaneswar,"IDCO Plot No1/A, Bhagbanpur Industrial Estate, DN Square, Patrapada, Bhubhaneswar 751001",20.240903,85.758056,AC Fast Charging,EV1,24-Jul,?10 k/Wh,"Wifi, Parking"
"French Toast, Kacheripady",Kerala,kochi,"Chittoor Rd, near Westend Eye Hospital, Kacheripady, Kochi, Kerala ",9.9878416,76.2827333,AC Fast Charging,EV1,24-Jul,?8 k/Wh,"No Wifi, No Parking"
Subway Aundh,Maharashtra,pune,"1 Samar Paradise, DP Rd, Aundh, Pune, Maharashtra 411007",18.56048188,73.80504099,DC Fast Charging,EV2,24-Jul,?9 k/Wh,"Wifi, Parking"
"Sara Automobile, Dobhi",Bihar,Gaya,"Sara Automobile Pvt Ltd, Eicher agency,NH-2  Opp:  Punjab National Bank, Suramandal near check post, Dobhi,  Gaya  PIN u00e2u0080u0093 824201",24.525355,84.932182,AC Fast Charging,EV1,24-Jul,?8 k/Wh,Parking
"Shankar Motors, Prem Nagar",Bihar,Bhagalpur,"Ground Floor, Sabour Rd, near Engineering College, Prem Nagar, Bhagalpur, Bihar 812002",25.2522094,87.0450289,DC Fast Charging,EV2,24-Jul,?10 k/Wh,Wifi
Tata Power ,Bihar,Purnea,"Shankar Motors, NH 31 Kishanganj Road, NH 31 Kishanganj Road, Damka, near Gulabbagh, Purnea, Bihar 854326",25.7952561,87.5593019,AC Fast Charging,EV1,24-Jul,?9 k/Wh,"No Wifi, No Parking"
Food Sixteen Restaurant,Delhi,delhi,"Metro Station, A-16, Grand Trunk Rd, near Adarsh Nagar, Indira Nagar, Azadpur, New Delhi",28.7169145,77.168538,DC Fast Charging,EV2,24-Jul,?7 k/Wh,Wifi
IIT Madras (ICSR),Tamil Nadu,chennai,"Near Gajendra Circle, Opposite to Admin Building, Indian Institute Of Technology, Adyar, Chennai, Tamil Nadu ",12.9917014,80.232102,AC Fast Charging,EV1,24-Jul,?8 k/Wh,Wifi
Atherspace Chennai,Tamil Nadu,chennai,"No.153, Wallace Garden 2nd St, Thousand Lights West, Nungambakkam, Chennai, Tamil Nadu 600006",13.060965,80.248509,DC Fast Charging,EV2,24-Jul,?10 k/Wh,Wifi
"Sairam Automobiles, Krishna Nagar",Chattisgarh,Bhilai,"Sairam auto G. E Road, Krishna Nagar, Supela, Bhilai, Chhattisgarh 490023",21.2165392,81.401487,AC Fast Charging,EV1,24-Jul,?8 k/Wh,"No Wifi, No Parking"
"BHASIN VENTURES, Telibandha",Chhattisgarh,Raipur,"NH-6, NEAR CHOKRA NALA, Labhandi Rd, opp. M.S. PETROL PUMP P.O, Ravigram, Telibandha, Raipur, Chhattisgarh 492006",21.2378172,81.6896148,DC Fast Charging,EV2,24-Jul,?9 k/Wh,Wifi
"Bahubali Motors, Transport Nagar",Chhattisgarh,Raipur,"Mumbai - Kolkata Hwy, Beside M.P Dhaba, Transport Nagar, Tatibandh, Raipur, Chhattisgarh 492099",21.2567897,81.5594445,AC Fast Charging,EV1,24-Jul,?10 k/Wh,"Wifi, Parking"
"Prince Guest House & Restaurant, Transport Nagar",Chhattisgarh,Raipur,"In front of Parking No 6 Transport Nagar, Rawa bata, Raipur, Chhattisgarh 492003",21.3194434,81.6372966,DC Fast Charging,EV2,24-Jul,?8 k/Wh,Wifi
"Jagdalpur Motors, Geedam Road",Chhattisgarh,Jagdalpur,"Geedam Rd, Pandripan, Chhattisgarh 492099",19.0657802,81.9635956,AC Fast Charging,EV1,24-Jul,?8 k/Wh,"No Wifi, No Parking"
Aaranyam Restaurant & Cafe ,Chhattisgarh,raipur,"near Vedanta Balco Medical Center, Sector 24, Nawagaon Parsatti, Naya Raipur, Chhattisgarh ",21.134229,81.7723096,DC Fast Charging,EV2,24-Jul,?9 k/Wh,Wifi
EESL Mantralaya Naya Raipur,Chhattisgarh,Raipur,"Sector 19, Kotara Bhantha, Naya Raipur, Chhattisgarh 492101",21.16012192,81.79515321,AC Fast Charging,EV1,24-Jul,?8 k/Wh,Wifi
EESL Prayas Bhawan Naya Raipur,Chhattisgarh,Raipur,"Public Parking, Prayas Bhawan, Sec -19, Atal Nagar, Nava Raipur",21.163948,81.788547,AC Fast Charging,EV1,24-Jul,?7 k/Wh,"No Wifi, No Parking"
"Sairam Automobiles, Light Industrial Area",Chhattisgarh,Khursipar," Zone III, Light Industrial Area, Khursipar, Chhattisgarh 490011",21.206036,81.3418606,DC Fast Charging,EV2,24-Jul,?10 k/Wh,"Wifi, Parking"
"Sairam Automobiles, Krishna Nagar",Chhattisgarh,Bhilai,"Sairam auto G. E Road, Krishna Nagar, Supela, Bhilai, Chhattisgarh 490023",21.2165392,81.401487,DC Fast Charging,EV2,24-Jul,?10 k/Wh,"Wifi, Parking"
Tata Power ,Chhattisgarh,Raipur,"Le ROI, Raipur, Raipur Railway Station, Loco Colony, Gudhiyari, Raipur, Chattisgarh - 492009",21.255366,81.62943,DC Fast Charging,EV2,24-Jul,?12 k/Wh,"Wifi, Parking"
"Bahubali Motors, Transport Nagar",Chhattisgarh,Raipur,"Mumbai - Kolkata Hwy, Beside M.P Dhaba, Transport Nagar, Tatibandh, Raipur, Chhattisgarh 492099",21.2567897,81.5594445,AC Fast Charging,EV1,24-Jul,?8 k/Wh,"Wifi, Parking"
"Prince Guest House & Restaurant, Transport Nagar",Chhattisgarh,Raipur,"In front of Parking No 6 Transport Nagar, Rawa bata, Raipur, Chhattisgarh 492003",21.3194434,81.6372966,AC Fast Charging,EV1,24-Jul,?9 k/Wh,"No Wifi, No Parking"
"Goyal Coal Sizing, Pendridih",Chhattisgarh,Bilaspur,"Village: Sara Pendridih Seepat, Bilaspur By-Pass, Chhattisgarh 495330",22.0136612,82.0487988,AC Fast Charging,EV1,24-Jul,?10 k/Wh,"Wifi, Parking"
Roy ka rasoi,West Bengal,siliguri,"Netaji Subhas Road, Ward 20, Subhas Pally, Siliguri, West Bengal",26.7055489,88.4380447,AC Fast Charging,EV1,24-Jul,?7 k/Wh,"Wifi, Parking"
GJ | Chikhali | Chikhli - Hotel Empire,Gujarat,Gujarat,"Hotel Empire, PO- Rola, Via- Dungri, NH-8, Gujarat 396375",20.6909,72.9496,"Hotel Empire, PO- Rola, Via- Dungri, NH-8, Gujarat 396375",DC Fast Charging,24-Jul,24-Jul,?11 k/Wh
"Ather Space, Kochi",Kerala,kochi,"Ponnurunni-Chalikkavattom Rd, Ponnurunni East, Ponnurunni, Vyttila, Ernakulam, Kerala ",9.98014,76.3173646,DC Fast Charging,EV2,24-Jul,?9 k/Wh,"Wifi, Parking"
AtherSpace Mysore,Karnataka,mysore,"#1A, A1, Hunsur Main Rd, Hinkal",12.325053,76.611337,DC Fast Charging,EV2,24-Jul,?10 k/Wh,"Wifi, Parking"
Irani Chai,Karnataka,bengaluru,"294, 15th Cross Rd, Sector 4, HSR Layout, Bengaluru",12.91371,77.644164,AC Fast Charging,EV1,24-Jul,?8 k/Wh,"No Wifi, No Parking"
M's Street,Tamil Nadu,chennai,"N0, 396/1, Mambakkam - Medavakkam Main Rd, Munusamy Nagar, Vimala Nagar, Medavakkam",12.9149592,80.1920666,AC Fast Charging,EV1,24-Jul,?8 k/Wh,"Wifi, Parking"
Radisson Bengaluru City Center,Karnataka,bengaluru,"2, Gangadhar Chetty Rd, Yellappa Chetty Layout, Sivanchetti Gardens, Halasuru",12.976339,77.619717,AC Fast Charging,EV1,24-Jul,?8 k/Wh,"Wifi, Parking"
Hotel Kuppana,Andhra Pradesh,tirupati,"5th Cross Rd, Tirumala Reddy Nagar, Mangalam, Tirupati, Andhra Pradesh 517507",13.648073,79.446494,DC Fast Charging,EV2,24-Jul,?10 k/Wh,"Wifi, Parking"
Ather Space Vijayawada,Andhra Pradesh,vijayawada,"KP Nagar Main Rd, Gurunanak Nagar, K P Nagar, Benz Circle, Vijayawada, Andhra Pradesh ",16.5007264,80.6574292,DC Fast Charging,EV2,24-Jul,?10 k/Wh,"Wifi, Parking"
Flip Side,Andhra Pradesh,hyderabad,"ISB Rd, Financial District, Nanakramguda, Hyderabad, Telangana",17.4139784,78.3275492,AC Fast Charging,EV1,24-Jul,?9 k/Wh,"Wifi, Parking"
Almond House SD Road,Andhra Pradesh,hyderabad,"9-1-109/1B, Regimental Bazaar, Shivaji Nagar,",17.441011,78.503158,DC Fast Charging,EV2,24-Jul,?12 k/Wh,"No Wifi, No Parking"
The Vizag Drive In,Andhra Pradesh,visakhapatnam,"4-72-12, Beach Road, next to BPCL Petrol Bunk, Lawsons Bay Colony, Visakhapatnam, Andhra Pradesh ",17.7314545,83.3405749,DC Fast Charging,EV2,24-Jul,?11 k/Wh,"Wifi, Parking"
Bliss Bakery & Cafe,Maharashtra,pune,"Narayan Tower, near, Narayan Annaji Shinde Rd, Salunkhe Vihar Society, Kondhwa, Pune, Maharashtra ",18.4788385,73.9013856,AC Fast Charging,EV1,24-Jul,?9 k/Wh,"Wifi, Parking"
Cafe Peter,Maharashtra,pune,"Waman Ganesh Heights, Pashan Rd, Bavdhan, Pune, Maharashtra",18.5105106,73.7819022,AC Fast Charging,EV1,24-Jul,?8 k/Wh,"No Wifi, No Parking"
WeFix Automobile,Maharashtra,pune,"Plot no.27(Residential, PCNTDA, Sector 10, Shriram Colony, Bhosari, Pune, Maharashtra ,Bhosari",18.64837725,73.82986626,DC Fast Charging,EV2,24-Jul,?10 k/Wh,"Wifi, Parking"
Hotel Om Navratna,Maharashtra,mumbai,"1/766, Old Mumbai Pune Highway, Near Agarwal Movers & Packers Ltd, at post Chouk",18.9014249,73.23657885,AC Fast Charging,EV1,24-Jul,?9 k/Wh,"No Wifi, No Parking"
Ather Space Ahmedabad,Gujarat,ahmedabad,"Shop No. 01, Ground floor, 3rd Eye Vision Opp. Shivalik Plaza, near AMA, Panjrapole CharRasta, Ahmedabad, Gujarat ",23.0281973,72.5432892,DC Fast Charging,EV2,24-Jul,?10 k/Wh,"Wifi, Parking"
"Vishnu Tradex, Shreekunj Elegance",Gujarat,ahmedabad,"2 SHREEKUNJ ELIGANCE, near SAHAJ PARADISE BANGLOW, Ahmedabad, Gujarat ",23.0735526,72.520875,DC Fast Charging,EV2,24-Jul,?12 k/Wh,"No Wifi, No Parking"
Royal Global University,Assam,guwahati,"NH-37, opp. Tirupati Balaji Temple, Betkuchi, Guwahati, Assam 781035",26.112203,91.7241576,AC Fast Charging,EV1,24-Jul,?9 k/Wh,"Wifi, Parking"
Ather Space Siliguri,West Bengal,siliguri,"Sevoke Rd, opposite Vishal Cinema Hall, Ward Number 13, Bankim Nagar, Siliguri, West Bengal ",26.7321074,88.4322712,DC Fast Charging,EV2,24-Jul,?10 k/Wh,"Wifi, Parking"
Loom Solar Warehouse,Haryana,faridabad,"Plot No. 21, 1, Mathura Rd, Pocket 3, Rajiv Enclave, Sector 6, Faridabad, Haryana 121006",28.3520623,77.3007942,AC Fast Charging,EV1,24-Jul,?8 k/Wh,"No Wifi, No Parking"
Throttle Shrottle Moto Cafe,Haryana,gurugram,"Faridabad - Gurgaon Rd, Baliawas, Bandhwari, Haryana 122102",28.428213,77.1405458,DC Fast Charging,EV2,24-Jul,?11 k/Wh,"Wifi, Parking"
"ARDEE MALL, Sec 52 Gurgaon",Haryana,Gurgaon,"Ardee City Road, Sector 52, Gurgaon-122022",28.444672,77.08082,AC Fast Charging,EV1,24-Jul,?9 k/Wh,"Wifi, Parking"
Atul Automobile Vasant Kunj,Delhi,New Delhi,"Vasant Kunj Mall Road, Pocket 5, Sector C, Vasant Kunj, New Delhi, Delhi 110070",28.52290663,77.15668214,DC Fast Charging,EV2,24-Jul,?10 k/Wh,"Wifi, Parking"
Volltic DCS08,Delhi,New Delhi,"Golden Ikon Fleet Management, Iffco chowk delhi",28.52360775,77.08321547,AC Fast Charging,EV1,24-Jul,?8 k/Wh,"No Wifi, No Parking"
IOCL Rajokri Station,Delhi,New Delhi,"NH 8 Exit 4, Samalka, New Delhi, Delhi 110037",28.5248,77.101,AC Fast Charging,EV1,24-Jul,?9 k/Wh,"Wifi, Parking"
EV Plugin Charge Vasant Square Mall,Delhi,New Delhi,"Vasant Kunj Marg, Pocket 5, Sector B, Vasant Kunj, New Delhi, Delhi 110070",28.52544024,77.15590041,DC Fast Charging,EV2,24-Jul,?10 k/Wh,"Wifi, Parking"
EESL Malviya Nagar Delhi,Delhi,New Delhi,"Guru Gobind Singh Marg, Old Market, Block C, Malviya Nagar, New Delhi, Delhi 110017",28.53646664,77.21145062,DC Fast Charging,EV2,24-Jul,?12 k/Wh,"Wifi, Parking"
PTC  IGI Airport,Delhi,New Delhi,"GI Airport, T3 Road, Indira Gandhi International Airport, New Delhi, Delhi - 110037",28.54851804,77.10435748,DC Fast Charging,EV2,24-Jul,?12 k/Wh,"Wifi, Parking"
EESL SDA Market,Delhi,Delhi,"Unnamed Road, Block C 5, Hauz Khas Enclave, Hauz Khas, New Delhi, Delhi 110016",28.54873377,77.19657963,AC Fast Charging,EV1,24-Jul,?8 k/Wh,"No Wifi, No Parking"
BRPL Nehru Place,Delhi,New Delhi,"BSES Bhawan, near Kalkaji Mandir metro station, Nehru Place, New Delhi, Delhi 110019",28.5495423,77.2545699,DC Fast Charging,EV2,24-Jul,?11 k/Wh,"Wifi, Parking"
"Pacific Mall,  Dwarka",Delhi,Delhi,"Dwarka sector 21 metro station, PACIFIC MALL, Sector 22 Rd, Sector 21, Dwarka, New Delhi, Delhi 110077",28.5512199,77.056702,DC Fast Charging,EV2,24-Jul,?12 k/Wh,"Wifi, Parking"
EESL R block GK1,Delhi,Delhi,"Hansraj Gupta Rd, Greater Kailash I, Greater Kailash, New Delhi, Delhi 110048",28.55155916,77.24469874,AC Fast Charging,EV1,24-Jul,?9 k/Wh,"No Wifi, No Parking"
EESL Aurbindo Market Place,Delhi,New Delhi,"Block C 2, Bhim Nagri, Hauz Khas, New Delhi, Delhi 110016",28.55177869,77.2033166,AC Fast Charging,EV1,24-Jul,?8 k/Wh,"Wifi, Parking"
EESL N Block GK1,Delhi,New Delhi,"N Block, Greater Kailash I, Greater Kailash, New Delhi, Delhi 110048",28.55560464,77.23371054,AC Fast Charging,EV1,24-Jul,?10/kWh,"Wifi, Parking"
EESL PVR Priya Delhi,Delhi,New Delhi,"61, Community Center, Basant Nagar, Basant Lok, Vasant Vihar, New Delhi, Delhi 110027",28.55773691,77.1579439,AC Fast Charging,EV1,24-Jul,?10/kWh,"Wifi, Parking"
EESL Safderjung Enclave,Delhi,New Delhi,"Block B6, Humayunpur, Safdarjung Enclave, New Delhi, Delhi 110016",28.55917249,77.19648462,AC Fast Charging,EV1,24-Jul,?10/kWh,"Wifi, Parking"
MG DELHI LAJPAT NAGAR,Delhi,NEW DELHI,"A-14, Ring Road, Lajpat nagar, Delhi 110024",28.564863,77.236743,DC Fast Charging,EV2,24-Jul,?12/kWh,"Wifi, Parking"
IOCL Mathura Road,Delhi,New Delhi,"No A12, Mathura Rd, near Telephone Exchange, Friends Colony East, New Delhi, Delhi 110025",28.566,77.2664,DC Fast Charging,EV2,24-Jul,?12/kWh,"Wifi, Parking"
IOCL Nehru Nagar Station,Delhi,New Delhi,"10-C, Nehru Nagar, Ring Rd, near Lajpat Nagar, New Delhi, Delhi 110065",28.5682,77.2531,DC Fast Charging,EV2,24-Jul,?12/kWh,"Wifi, Parking"
EESL Delhi Haat,Delhi,Delhi,"NMDC Parking, Dilli Haat, West Kidwai Nagar, New Delhi 110023",28.572793,77.208662,AC Fast Charging,EV1,24-Jul,?10/kWh,"Wifi, Parking"
EESL Dilli Haat,Delhi,New Delhi,"NDMC Parking, Dilli Haat, West Kidwai Nagar, New Delhi - 110023",28.57357604,77.207152,AC Fast Charging,EV1,24-Jul,?10/kWh,"Wifi, Parking"
