name,state,city,address,latitude,longitude,Charging Type,Supported Vehicle Types,access hours,Pricing Information,Amenities
"Gokulam Grand, Kovalam",Kerala,Trivandrum,"TC 63, 512 TO 523, Beach Rd, Kovalam, Kerala 695527",8.390198,76.976356,DC Fast Charging,EV2,24-Jul,?10 k/Wh,"Wifi, Parking"
KSEB Nemom,Kerala,Nemom,"Karamana to Nagercoil Main Road, Nemom, Kerala 695020",8.453971667,77.00415034,AC Fast Charging,EV1,24-Jul,?7 k/Wh,Wifi
KSEB NEMOM,Kerala,THIRUVANANTHAPURAM,NEYYATTINKARA,8.460016017,77.00402472,DC Fast Charging,EV2,24-Jul,?8 k/Wh,"No Wifi, No Parking"
KSEB NEMOM,Kerala,Thiruvanthapuram,NEYYATTINKARA,8.460016017,77.00402472,DC Fast Charging,EV2,24-Jul,?8 k/Wh,"No Wifi, No Parking"
ANERT-EESL Sangamukham Kerala,Kerala,Thiruvanthapuram,"Sanghumukham DTPC office, Shanghumukham beach, thiruvananthapuram,Kerala- 605007",8.481159,76.912456,AC Fast Charging,EV1,24-Jul,?7 k/Wh,"No Wifi, No Parking"
ANERT-EESL Sangamukham Kerala,Kerala,Thiruvanthapuram,"Sanghumukham DTPC office, Shanghumukham beach, thiruvananthapuram,Kerala- 605007",8.481159,76.912456,AC Fast Charging,EV1,24-Jul,?7 k/Wh,"No Wifi, No Parking"
Anert -EESL Sangamukham Kerala,Kerala,Thiruvananthapuram,"Thiruvananthapuram, Shangumukham, Kannanthura, Thiruvananthapuram, Kerala 695008",8.481360724,76.91248155,AC Fast Charging,EV1,24-Jul,?7 k/Wh,"No Wifi, No Parking"
ANERT-EESL Thycaud Kerala,Kerala,Thiruvanthapuram,"State Council For Child Welfare, CV Raman Pillai Rd, Near Kerala, Housing Board, Thycaud, Thiruvananthapuram, Kerala 695014",8.4927752,76.9572956,AC Fast Charging,EV1,24-Jul,?7 k/Wh,"No Wifi, No Parking"
ANERT-EESL Thycaud Kerala,Kerala,Thiruvanthapuram,"State Council For Child Welfare, CV Raman Pillai Rd, Near Kerala, Housing Board, Thycaud, Thiruvananthapuram, Kerala 695014",8.4927752,76.9572956,AC Fast Charging,EV1,24-Jul,?7 k/Wh,"No Wifi, No Parking"
ANERT EESL thycaucd ,Kerala,Thiruvananthapuram,"State Council For Child Welfare, CV Raman Pillai Rd, Near Kerala, Housing Board, Thycaud, Thiruvananthapuram, Kerala 695014",8.492852084,76.95801444,AC Fast Charging,EV1,24-Jul,?7 k/Wh,"No Wifi, No Parking"
ANERT Zivah EV charger,Kerala,Thiruvananthapuram,"Vikas Bhavan P. O, Law College Rd, PMG, Thiruvananthapuram, Kerala 695033",8.50884848,76.94622254,DC Fast Charging,EV2,24-Jul,?9 k/Wh,"No Wifi, No Parking"
"OFFROAD, Motorcycle Accessories Shop",Kerala,trivandrum," Vazhayila - Kallayam Rd, Vazhayila, Padmanabha Nagar, Thiruvananthapuram, Kerala ",8.5513563,76.9726234,DC Fast Charging,EV2,24-Jul,?12 k/Wh,Wifi
"Ginger Hotel, Kazakuttom",Kerala,Trivandrum,"Ginger Hotel Trivandrum Electronics Technology Park, Technopark Campus, Club House, Kazakuttom, Trivandrum - 695581 Tel: 0471 666 3333",8.5615919,76.8763933,AC Fast Charging,EV1,24-Jul,?11 k/Wh,Wifi
"Muthoot Automotive, Mevaram",Kerala,Kollam,"Machoos Properties, Bypass, near Medicity Hospital, Mevaram, Kollam, Kerala 691020",8.87386,76.64112,AC Fast Charging,EV1,24-Jul,?9 k/Wh,"No Wifi, No Parking"
KSEBL OLAI,Kerala,THIRUVANANTHAPURAM,"NH 66, T D Nagar, Olayil, High School Jun, Kollam, Kerala 691009",8.892952791,76.57878733,AC Fast Charging,EV1,24-Jul,?8 k/Wh,"No Wifi, No Parking"
KSEBL OLAI,Kerala,Thiruvanthapuram,"NH 66, T D Nagar, Olayil, High School Jun, Kollam, Kerala 691009",8.892952791,76.57878733,AC Fast Charging,EV1,24-Jul,?8 k/Wh,"No Wifi, No Parking"
KSEB electrical section Olayil,Kerala,Kollam,"Salem - Kochi Hwy, Olayil, High School Jun, Kollam, Kerala 691009",8.892999143,76.57939218,AC Fast Charging,EV1,24-Jul,?7 k/Wh,"No Wifi, No Parking"
Tata Power ,Kerala,Pathanamthitta,"MK Motors, Churulikkodu Pathanamthitta, Milan Plaza, Churulikkodu, Pathanamthitta, Kerala 689668",9.2744022,76.7637408,DC Fast Charging,EV2,24-Jul,?12 k/Wh,Wifi
Kanthari Restaurants & Banquets,Kerala,Changanassery,"Bypass Road, near AKM school, Changanassery, Kerala 686101",9.4551752,76.5425594,AC Fast Charging,EV1,24-Jul,?8 k/Wh,"No Wifi, No Parking"
"Misty Mountain Teyla, Mundakayam",Kerala,Kottayam,"Mundakayam Glenrock office, Mundakayam, Kottayam, 686512",9.5447482,76.877561,AC Fast Charging,EV1,24-Jul,?10 k/Wh,"No Wifi, No Parking"
"Misty Mountain Teyla, Peermade",Kerala,Kuttikkanam,"HXJC+526, Peermade, Kuttikkanam, Kerala 685531",9.5802797,76.9701859,DC Fast Charging,EV2,24-Jul,?12 k/Wh,"Wifi, Parking"
ANERT-EESL AUTOKAST Kerala,Kerala,Perunnermangalam,"AUTOKAST premises, South East End adjacent to NH 66, Mararikulam North Village, Perunnermangalam, Muriyil.",9.63628,76.3352,AC Fast Charging,EV1,24-Jul,?8 k/Wh,"No Wifi, No Parking"
ANERT-EESL AUTOKAST Kerala,Kerala,Perunnermangalam,"AUTOKAST premises, South East End adjacent to NH 66, Mararikulam North Village, Perunnermangalam, Muriyil.",9.63628,76.3352,AC Fast Charging,EV1,24-Jul,?8 k/Wh,"No Wifi, No Parking"
"Sree Gokulam Motors, Edapally",Kerala,Kochi,"Skyline Gateway Apartments, Pathadipalam, Edappally, Ernakulam, Kerala 682033",9.9261126,76.317879,DC Fast Charging,EV2,24-Jul,?10 k/Wh,"Wifi, Parking"
"Malayalam Vehicles, Vytila",Kerala,Kochi,"Sharon Tower, No 52/3171, 3172, opposite Salafi Masjid, Vyttila, Ernakulam, Kerala 682019",9.9644345,76.3184956,AC Fast Charging,EV1,24-Jul,?9 k/Wh,Wifi
"IOCL - SR Adhoc u00e2u0080u0093 COCO, Vytilla",Kerala,Kochi,"Bus Stop, Janatha, Sahodaran Ayyappan Rd, Janatha Junction, Vyttila, Ernakulam, Kerala 682019",9.9685,76.312879,AC Fast Charging,EV1,24-Jul,?7 k/Wh,Parking
ANERT-EESL Ernakulam Kerala,Kerala,Kochi,"Shanmugham Road, Ernakulam, Marine Drive, Kochi, Kerala 682031",9.977005426,76.27780265,AC Fast Charging,EV1,24-Jul,?8 k/Wh,Wifi
ANERT-EESL Ernakulam Kerala,Kerala,Kochi,"KTDC Tourist Reception Centre Shanmugham road, Ernakulam, Marine drive, Kochi Kerala-682031",9.977164,76.27777,AC Fast Charging,EV1,24-Jul,?8 k/Wh,"Wifi, Parking"
ANERT-EESL Ernakulam Kerala,Kerala,Kochi,"KTDC Tourist Reception Centre Shanmugham road, Ernakulam, Marine drive, Kochi Kerala-682031",9.977164,76.27777,AC Fast Charging,EV1,24-Jul,?8 k/Wh,"Wifi, Parking"
KSEBL PALARIVATTOM,Kerala,THIRUVANANTHAPURAM,"Palarivattom - Edappally Rd, Sonia Nagar, Palarivattom, Ernakulam, Kerala 682565",10.00552573,76.3050448,DC Fast Charging,EV2,24-Jul,?10 k/Wh,"No Wifi, No Parking"
KSEBL PALARIVATTOM,Kerala,Thiruvanthapuram,"Palarivattom - Edappally Rd, Sonia Nagar, Palarivattom, Ernakulam, Kerala 682565",10.00552573,76.3050448,DC Fast Charging,EV2,24-Jul,?10 k/Wh,"No Wifi, No Parking"
Gokul Oottupura NH 47 Veetarian Restaurant,Kerala,Kochi ,"NH bypass, near Modern Lights, Padivattom, Edappally, Ernakulam, Kerala 682024",10.0111333,76.3123714,AC Fast Charging,EV1,24-Jul,?9 k/Wh,Wifi
KSEBL Palarivattom,Kerala,Ernakulam,"Executive Enginer, Electrical Division, Ernakulam",10.01921939,76.30459452,DC Fast Charging,EV2,24-Jul,?10 k/Wh,Parking
Grand mall,Kerala,Kochi ,"Panvel - Kochi - Kanyakumari Hwy, Toll Junction, Edappally, Kochi, Kerala 682024",10.0243734,76.3088679,DC Fast Charging,EV2,24-Jul,?12 k/Wh,"Wifi, Parking"
Tata Power ,Kerala,Munnar,"Gokulam Park Munnar, Power House Road, South Chithirapuram, Power House Road, Munnar - 685565",10.0297934,77.0458592,AC Fast Charging,EV1,24-Jul,?8 k/Wh,Parking
"Sree Gokulam Motors, Nettoor",Kerala,Kochi,"No. 10, 256/C, Survey No 1562/1, NH47, Bye Pass Road, Nettoor, Kochi-682040",10.039145,76.315574,DC Fast Charging,EV2,24-Jul,?10 k/Wh,Wifi
"CoastLine Garages, NH 47 Muttom",Kerala,Kochi,"Opposite Metro Pillar no 155 , NH 47, Muttom , Near Aluva , Cochin-683106",10.077281,76.337656,DC Fast Charging,EV2,24-Jul,?11 k/Wh,"No Wifi, No Parking"
"Malayalam Vehicles, Aluva",Kerala,Aluva,"Building No 18/615/1, 615/2 Sy No 176/2, 176/3, Aluva West, near Pulichode Signal, Kerala 683101",10.0999671,76.3476841,AC Fast Charging,EV1,24-Jul,?7 k/Wh,Parking
Annapoorna Cafe,Kerala,Angamali,"69FG+56H, Karukutty, Kerala 683572",10.2230435,76.3755255,DC Fast Charging,EV2,24-Jul,?10 k/Wh,"Wifi, Parking"
"IOCL - JRO Pongam, Thrissur",Kerala,Kizhakkummuri,JUBILEE RETAIL OUTLET KORATTY SOUTH POST THRISSUR DISTRICT-680308,10.245487,76.369589,AC Fast Charging,EV1,24-Jul,?9 k/Wh,"No Wifi, No Parking"
"Hyson Motors, Punkunnam",Kerala,Thrissur,"Guruvayur Rd, Puzhakkal, Punkunnam, Thrissur, Kerala 680002",10.540817,76.189423,DC Fast Charging,EV2,24-Jul,?12 k/Wh,Wifi
KSEBL Viyyur,Kerala,Thrissur,"Padukad, Keltron Nagar, Kolazhy, Thrissur, Kerala 680010",10.56044924,76.21714424,DC Fast Charging,EV2,24-Jul,?10 k/Wh,"No Wifi, No Parking"
KSEBL VIYYUR,Kerala,THIRUVANANTHAPURAM,"H668+2VH, Padukad, Keltron Nagar, Kolazhy, Thrissur, Kerala 680010",10.56052307,76.2172408,DC Fast Charging,EV2,24-Jul,?10 k/Wh,"No Wifi, No Parking"
KSEBL VIYYUR,Kerala,Thiruvanthapuram,"H668+2VH, Padukad, Keltron Nagar, Kolazhy, Thrissur, Kerala 680010",10.56052307,76.2172408,DC Fast Charging,EV2,24-Jul,?10 k/Wh,"No Wifi, No Parking"
Hotel Devaragam,Kerala,Guruvayur,"Outer Ring Road, Opp Railway Station, East Nada, Guruvayur, Kerala 680101",10.5955128,76.0443322,AC Fast Charging,EV1,24-Jul,?8 k/Wh,Wifi
"Gokulam Sabari, Guruvayur",Kerala,Thrissur,"North, Outer Ring Rd, Kuppaayil, Guruvayur, Kerala 680101",10.596516,76.04243,AC Fast Charging,EV1,24-Jul,?8 k/Wh,Parking
Sihla Energy Sihla Energy,Kerala,Malappuram,"Thrissur-Kunnakulam SH 69, Valayankulam, Kerala - 679591",10.73477485,76.04854399,DC Fast Charging,EV2,24-Jul,?10 k/Wh,Wifi
"Cake Bee, Singaram Nagar",Tamil Nadu,tiruchirappalli,"Ground Floor, No.7, Singaram Nagar, Kattur, Trichy Tamil Nadu, Trichy",10.7967137,78.7563467,AC Fast Charging,EV1,24-Jul,?6 k/Wh,"No Wifi, No Parking"
Trichi Kaveri Foods Private Limited,Tamil Nadu,tiruchirappalli,"19, Main road, Annamalai Nagar",10.8330993,78.6845337,AC Fast Charging,EV1,24-Jul,?7 k/Wh,"No Wifi, No Parking"
Adyar Ananda Bhavan I Navakkarai,Tamil Nadu,Walayar,"Adyar Ananda Bhavan Restaurant, 285, Palakkad Main Rd, MahendraMedu, Navakarai, Coimbatore, Tamil Nadu 641105",10.8559461,76.8625309,AC Fast Charging,EV1,24-Jul,?8 k/Wh,"Wifi, Parking"
AIMA Charging Station ,Kerala,Palakkad,"Naduvattam, Kringanad Rd, VIlayur ",10.887677,76.189595,AC Fast Charging,EV1,24-Jul,?7 k/Wh,"No Wifi, No Parking"
KSEBL NALLALAM,Kerala,THIRUVANANTHAPURAM,"Modern Bazar, Nallalam, Kozhikode, Kerala 673018",11.20838069,75.80848587,DC Fast Charging,EV2,24-Jul,?10 k/Wh,"Wifi, Parking"
KSEBL NALLALAM,Kerala,Thiruvanthapuram,"Modern Bazar, Nallalam, Kozhikode, Kerala 673018",11.20838069,75.80848587,DC Fast Charging,EV2,24-Jul,?10 k/Wh,"Wifi, Parking"
"Marina Motors, Pantheerankavu",Kerala,Kozhikode,"Bye Pass Road, Pantheerankavu, Kozhikode-673019",11.217,75.85801,AC Fast Charging,EV1,24-Jul,?9 k/Wh,Parking
HiLITE Mall,Kerala,Kozhikode,"G1003, NH 66, Kozhikode Bypass, Poovangal, Kozhikode, Kerala 673014",11.2484737,75.8335122,DC Fast Charging,EV2,24-Jul,?12 k/Wh,Wifi
HiLite Mall,Kerala,calicut,"G1003, NH 66, Kozhikode Bypass, Poovangal, Kozhikode, Kerala ",11.248533,75.8334487,DC Fast Charging,EV2,24-Jul,?12 k/Wh,"Wifi, Parking"
"CoastLine Garages, Kannur Road",Kerala,Kozhikode,"Opposite West Hill Post Office, Kannur Road , West Hill P.O , Kozhikode-673005",11.282287,75.770054,AC Fast Charging,EV1,24-Jul,?9 k/Wh,"No Wifi, No Parking"
"KVR Dream vehicles, Nadal",Kerala,Kannur,"Ground Floor, Kizhunna - Kadappuram Rd, Chirakku Thazhe, Nadal, Kerala 670007",11.83301,75.42643,AC Fast Charging,EV1,24-Jul,?7 k/Wh,"No Wifi, No Parking"
KSEBL CHOVVA,Kerala,THIRUVANANTHAPURAM,"Kannur - Kuthuparamba Rd, Elayavoor, Kerala 670331",11.86893912,75.40316573,DC Fast Charging,EV2,24-Jul,?10 k/Wh,"No Wifi, No Parking"
KSEBL CHOVVA,Kerala,Thiruvanthapuram,"Kannur - Kuthuparamba Rd, Elayavoor, Kerala 670331",11.86893912,75.40316573,DC Fast Charging,EV2,24-Jul,?10 k/Wh,"No Wifi, No Parking"
"KVR Dream vehicles, Vidya Nagar",Kerala,Kasargod,"Panalam Nayamar Moola, Alampady Manya Road, Vidya Nagar, PO, Kasaragod, Kerala 671123",12.51382323,75.02713173,AC Fast Charging,EV1,24-Jul,?8 k/Wh,Parking
"Naattarasan, Urapakkam",Tamil Nadu,chennai,"No: 245, GST Road, Opp to Indian Oil Bunk, Urapakkam, Chennai, Tamil Nadu ",12.8570595,80.0694857,DC Fast Charging,EV2,24-Jul,?10 k/Wh,"No Wifi, No Parking"
"Magenta, Hosur Road",Karnataka,bengaluru,"Pattalama Layout, Hosur Rd, Singasandra ",12.876703,77.646505,AC Fast Charging,EV1,24-Jul,?9 k/Wh,Wifi
Uma complex,Tamil Nadu,chennai,"No 14, Professors colony extn, Indian airforce road, East Tambaram",12.9149033,80.1266472,DC Fast Charging,EV2,24-Jul,?12 k/Wh,"Wifi, Parking"
NAKSHATRA PURE VEG,Tamil Nadu,chennai,"No.93, Bazaar Road, Madipakkam Main Rd, Ram Nagar South, Madipakkam",12.9644294,80.2118897,AC Fast Charging,EV1,24-Jul,?7 k/Wh,"No Wifi, No Parking"
Ather Space Kolhapur,Maharashtra,kolhapur,"C.S. No. 195K/2K, Kavala Naka, E-Ward, Kolhapur ",16.70757943,74.25106938,DC Fast Charging,EV2,24-Jul,?11 k/Wh,Wifi
Zozoz Pizzeria,Telangana,hyderabad,"Rd Number 45, opposite Khazana, CBI Colony, Jubilee Hills, Hyderabad, Telangana ",17.4306503,78.4020035,AC Fast Charging,EV1,24-Jul,?9 k/Wh,"No Wifi, No Parking"
"Heart Cup Coffee, Gachibowli",Telangana,hyderabad,"Old Mumbai Hwy, next to HP Petrol Pump (Venkatadri Fuel Point, FCI Employees Cooperative Housing Society, Indira Nagar, Gachibowli, Hyderabad, Telangana ",17.4453566,78.3556014,DC Fast Charging,EV2,24-Jul,?10 k/Wh,"Wifi, Parking"
Noma Talkies,Telangana,hyderabad,"3-4-99, Nacharam - Mallapur Rd, May Flower Hights, Vivekananda Nagar, Mallapur, Secunderabad, Telangana",17.447469,78.57175,AC Fast Charging,EV1,24-Jul,?8 k/Wh,Wifi
F3 Drive-in,Telangana,hyderabad,"near Fusion International School, Ameenpur, Miyapur, Telangana",17.5173192,78.3188293,DC Fast Charging,EV2,24-Jul,?12 k/Wh,"No Wifi, No Parking"
Hungry Hippo,Andhra Pradesh,visakhapatnam,"50-49-43/A, TPT Colony, Balayya Sastri Layout, Seethammadara, Visakhapatnam, Andhra Pradesh 530013",17.74070386,83.31168582,AC Fast Charging,EV1,24-Jul,?7 k/Wh,Parking
Kalinga Veg Gourmet Kitchen,Maharashtra,pune,"1st - 3rd Floor, House of Nosh, CTS 1365, Gulawani Maharaj Road, Swaroop Society, Vakil Nagar, Erandwane, Pune, Maharashtra ",18.5050103,73.8316238,DC Fast Charging,EV2,24-Jul,?11 k/Wh,Wifi
Shree Purohit Thali ,Maharashtra,nashik,"bus stop, Andhashala, Nashik - Pune Rd, Nashik, Maharashtra",19.9615119,73.8272912,AC Fast Charging,EV1,24-Jul,?9 k/Wh,"No Wifi, No Parking"
"Coffee King, Adajan",Gujarat,surat,"1,2. Abhinandan Heights, Nr.madhuvan circle, LP Savani Rd, Adajan Gam, Adajan, Surat, Gujarat ",21.1917016,72.7900328,DC Fast Charging,EV2,24-Jul,?10 k/Wh,"No Wifi, No Parking"
Ather Space Jaipur,Rajasthan,jaipur,"BL Tower, 2, Tonk Rd, near Sanghi Farm, Durgapura",26.854201,75.794615,AC Fast Charging,EV1,24-Jul,?8 k/Wh,Wifi
"Throttle Shrottle Moto Cafe, Noida",Uttar Pradesh,noida,"Village rohillapur. Opposite step by step school sector-132, Noida - 201304",28.5123936,77.3743113,DC Fast Charging,EV2,24-Jul,?11 k/Wh,"No Wifi, No Parking"
"Ather Space, Lajpat Nagar",Delhi,delhi,"A-32, Feroze Gandhi Rd, Lajpat Nagar II, Delhi ",28.5705131,77.2368888,AC Fast Charging,EV1,24-Jul,?9 k/Wh,Wifi
Oyo Townhouse 278 Rohini,Delhi,delhi,"6-A, Pocket 27, Sector-24, Rohini, Delhi, 110085, New Delhi, Delhi",28.7328878,77.0841225,AC Fast Charging,EV1,24-Jul,?10 k/Wh,Parking
"Malayalam Vehicles, Aluva",Kochi,Aluva,"Building No 18/615/1, 615/2 Sy No 176/2, 176/3, Aluva West, near Pulichode Signal, Kerala 683101",10.0999671,76.3476841,DC Fast Charging,EV2,24-Jul,?12 k/Wh,Wifi
GJ | Limbdi | HFM (Highway Food Mall) ,Gujarat,Limbdi,"Highway Food Mall, Nr. Limbdi Over Bridge, National Highway No.8A, Limbdi u00e2u0080u0093 363421.",22.5676,71.7741,Limbdi,"Highway Food Mall, Nr. Limbdi Over Bridge, National Highway No.8A, Limbdi  363421.",24-Jul,EV1,24-Jul
"Cake Bee, Cantonment",Tamil Nadu,tiruchirappalli,"3/A, Bharathidasan Salai, near Campion School, Cantonment, Tamil Nadu, Trichy",10.8024024,78.6824181,DC Fast Charging,EV2,24-Jul,?10 k/Wh,Wifi
"Adyar Ananda Bhavan, Navakari | Zeon",Tamil Nadu,coimbatore,"285, Palakkad main road, Navakarai",10.8556755,76.862332,"285, Palakkad main road, Navakarai",AC Fast Charging,24-Jul,24-Jul,?7 k/Wh
Cue Campus,Karnataka,hubli,"B 4 chetan complex opp kims main gate Vidhyagar, PB Rd, Vidya Nagar",15.360651,75.126774,DC Fast Charging,EV2,24-Jul,?11 k/Wh,Wifi
"Hotel Grand Leela Krishna, Bhimavaram",Andhra Pradesh,Bhimavaram,"Undi Rd, Balusumoodi, Bhimavaram, Andhra Pradesh 534202",16.5451748,81.5199403,AC Fast Charging,EV1,24-Jul,?9 k/Wh,Parking
Charminar Chowrasta Cafe,Andhra Pradesh,visakhapatnam,"12-43/4 GF, R K Nagar, Pothinamallayya Palem, Visakhapatnam, Andhra Pradesh ",17.8000838,83.3473927,DC Fast Charging,EV2,24-Jul,?12 k/Wh,"No Wifi, No Parking"
Electric Vehicle Charging Station,Madhya Pradesh,Indore,"Near Rajkumar Bridge, Snehlataganj, Indore, Madhya Pradesh 452001",22.72739982,75.86813789,AC Fast Charging,EV1,24-Jul,?8 k/Wh,Wifi
"Shyam Automotive, AB Road",Madhya Pradesh,Indore,"A B Road, Before Emerald Heights School, Indore, Madhya Pradesh 453331",22.6520302,75.821321,DC Fast Charging,EV2,24-Jul,?11 k/Wh,"No Wifi, No Parking"
"IOCL - Vrindavan Fuels, Mangal Nagar,Manikbagh",Madhya Pradesh,Indore,"Manikbagh, Mangal Nagar, Indore, Madhya Pradesh 452014",22.6848351,75.8558249,AC Fast Charging,EV1,24-Jul,?10 k/Wh,Wifi
"Hriday Cars, AB Road",Madhya Pradesh,Indore,"1/2-Anoop Nagar,AB Road Indore-452001",22.7307225,75.8893731,DC Fast Charging,EV2,24-Jul,?12 k/Wh,"No Wifi, No Parking"
Volltic UJ001,Madhya Pradesh,Ujjain,"8 Ghatkarpar Marg, above Mayank Traders, Madhav Nagar, Ujjain, Madhya Pradesh 456001",23.179326,75.78437678,AC Fast Charging,EV1,24-Jul,?8 k/Wh,Wifi
"IOCL COCO u00e2u0080u0093 Extoll College Br., Bhawadita Kalan",Madhya Pradesh,Bhopal,"80/2/1/1/2 Bhawadiya Kalan, Bhopal 462026",23.182404,77.432496,DC Fast Charging,EV2,24-Jul,?12 k/Wh,"No Wifi, No Parking"
Tata Power ,Madhya Pradesh,Bhopal,"Hriday Cars, Hoshangabad Road, Near Shiv Mandir , Ahmedpur Kalan Hoshangabad Road Bhopal 462026",23.1891128,77.4515544,AC Fast Charging,EV1,24-Jul,?10 k/Wh,Wifi
Paschim Vidyut Vitaran Pologround,Madhya Pradesh,UJJAIN,"GPH Compound, Polo Ground, Indore, Madhya Pradesh 452003",23.24006,75.78122,DC Fast Charging,EV2,24-Jul,?11 k/Wh,Parking
"Varenyam Motor Car, Industrial Area",Madhya Pradesh,Bhopal,"56-57 JK Road Govindpura, Sector A, Govindpura Industrial Area, Bhopal, Madhya Pradesh 462023",23.259006,77.456769,AC Fast Charging,EV1,24-Jul,?9 k/Wh,Wifi
R R Sales,Assam,guwahati,"Saraf Building, Near Police Reserve RLY gate, no 2, Assam Trunk Rd, Guwahati, Assam",26.1763362,91.7404708,DC Fast Charging,EV2,24-Jul,?12 k/Wh,"No Wifi, No Parking"
"Hotel Suba Palace, Fort",Maharashtra,Mumbai,"Apppllo Bunder Road, Near Gate way of India, fortu00c2u00a0 Mumbai 400039",18.9241214,72.8328155,AC Fast Charging,EV1,24-Jul,?9 k/Wh,"No Wifi, No Parking"
"Trimurti Petroleum, Panvel",Maharashra,Navi Mumbai,"GUT NO.151/2, VILLAGE - AJIVALI, TALUKA - PANVEL, RAIGAD, AJIVALI, 410216",18.9563188,73.1626506,DC Fast Charging,EV2,24-Jul,?11 k/Wh,Wifi
"Hotel Suba International, Andheri East",Maharashra,Mumbai,"Saharu00c2u00a0 Road, Near Cigarret Factory, Chakala, Andheri East Mumbai 400099",19.1063175,72.8603219,AC Fast Charging,EV1,24-Jul,?8 k/Wh,Parking
"Hotel Suba Galaxy, Andheri East",Maharashra,Mumbai,"NS Phadake Marg, Opp Teli galli,Near Eastern expres Highway, Andheri East Mumbai 400069",19.1142415,72.8518766,DC Fast Charging,EV2,24-Jul,?12 k/Wh,Wifi
"CR - Bhandup Station, Bhandup East",Maharashra,Mumbai,"Bhandup Station East, near Kotak Mahindra ATM, Bhandup, Bhandup East, Mumbai, Maharashtra 400042",19.1420246,72.937755,AC Fast Charging,EV1,24-Jul,?8 k/Wh,"No Wifi, No Parking"
"Breadworld, Jawahar Nagar",Kerala,kochi,"Subhash Chandra Bose Road,  Jawahar Nagar, Kadavanthra,  Ernakulam, Kerala ",9.9721366,76.3020765,AC Fast Charging,EV1,24-Jul,?8 k/Wh,"Wifi, Parking"
Kalanthans Cafe,Kerala,kochi,"Palarivattom, Kochi",10.00260117,76.30400712,AC Fast Charging,EV1,24-Jul,?7 k/Wh,"No Wifi, No Parking"
"Grand Mall, Kochi",Kerala,kochi,"Panvel - Kochi - Kanyakumari Hwy, Toll Junction, Edappally, Kochi, Kerala ",10.0244123,76.3089558,DC Fast Charging,EV2,24-Jul,?10 k/Wh,"Wifi, Parking"
Devaragam Hotel,Kerala,trichur,"Outer Ring Road, Opp Railway Station, East Nada, Guruvayur",10.59556473,76.04433704,AC Fast Charging,EV1,24-Jul,?9 k/Wh,Parking
Sultan of Flavours Restaurant,Kerala,palakkad,"Stadium Bypass Rd, Sultanpet, Palakkad",10.76725155,76.66031232,AC Fast Charging,EV1,24-Jul,?8 k/Wh,Wifi
"Ather Space, Trichy",Tamil Nadu,tiruchirappalli,"20/C113, 5th Cross, Thillai Nagar,Trichy - 620018",10.8240776,78.684925,DC Fast Charging,EV2,24-Jul,?11 k/Wh,"Wifi, Parking"
Trichy Sarathas,Tamil Nadu,tiruchirappalli,"No. 45, NSB Rd, Teppakulam, Tamil Nadu ",10.8267085,78.6959116,AC Fast Charging,EV1,24-Jul,?8 k/Wh,"No Wifi, No Parking"
"Ather Space, Coimbatore",Tamil Nadu,coimbatore,"357, Patel Rd, Ram Nagar, Coimbatore, Tamil Nadu ",11.0113482,76.9598159,DC Fast Charging,EV2,24-Jul,?10 k/Wh,"Wifi, Parking"
"Ather space, Malappuram",Kerala,malappuram,"SH 72, Kizhakkethala, Down Hill, Malappuram, Kerala 676505",11.0522217,76.0753978,DC Fast Charging,EV2,24-Jul,?12 k/Wh,"No Wifi, No Parking"
Lakshmi Pazhamudir And Supermarket,Tamil Nadu,coimbatore,"post Gas company, Mettupalayam Rd, Ranganayaki Nagar, Dhamu Nagar, Therkkuppalayam, Coimbatore, Tamil Nadu ",11.13813848,76.94073103,AC Fast Charging,EV1,24-Jul,?8 k/Wh,Parking
Tiruppur Sree Annapoorna,Tamil Nadu,coimbatore,"Road, Rayan Kovil, Avinashi, Tamil Nadu ",11.1750315,77.2634385,AC Fast Charging,EV1,24-Jul,?8 k/Wh,"Wifi, Parking"
Focus Mall,Kerala,calicut,"Rajaji Road, Calicut-  Kerala, India",11.2586377,75.7857046,DC Fast Charging,EV2,24-Jul,?10 k/Wh,"Wifi, Parking"
MR Hypermarket,Kerala,calicut,"Wayanad Rd, Moozhikkal, Kozhikode, Kerala ",11.296198,75.8307817,AC Fast Charging,EV1,24-Jul,?9 k/Wh,"No Wifi, No Parking"
"MR Hyper Market, Wayanad Road",Kerala,calicut,"8V9M+CM3, Kozhikode, Kerala ",11.3185163,75.8842814,AC Fast Charging,EV1,24-Jul,?9 k/Wh,"No Wifi, No Parking"
Cafe Cornucopia,Karnataka,mysore,"22nd Cross, 14th Main Rd, C Block, Vijay Nagar 3rd Stage, Garudachar Layout",12.316689,76.603223,AC Fast Charging,EV1,24-Jul,?7 k/Wh,Wifi
AtherSpace JP Nagar,Karnataka,bengaluru,"292, Outer Ring Rd, J P Nagar Phase 5",12.90620397,77.59080954,DC Fast Charging,EV2,24-Jul,?12 k/Wh,"Wifi, Parking"
UB City,Karnataka,bengaluru,"No 24, Vittal Mallya Road, KG Halli, D' Souza Layout, Ashok Nagar,",12.971406,77.595799,AC Fast Charging,EV1,24-Jul,?8 k/Wh,"Wifi, Parking"
GT World Mall,Karnataka,bengaluru,"Magadi Main Rd, next to Prasanna Theatre, Cholourpalya, Bengaluru, Karnataka 560023",12.97399998,77.55139923,DC Fast Charging,EV2,24-Jul,?11 k/Wh,"Wifi, Parking"
Prestige Saleh Ahmed,Karnataka,bengaluru,"No 24, Lady Curzon Road, Tasker Town, Shivaji Nagar,",12.980553,77.603318,AC Fast Charging,EV1,24-Jul,?9 k/Wh,Parking
Prestige Khoday Tower,Karnataka,bengaluru,"No 5, Raj Bhavan Road, Vasanth Nagar",12.982728,77.594179,AC Fast Charging,EV1,24-Jul,?8 k/Wh,"Wifi, Parking"
Park Square Mall,Karnataka,bengaluru,"UB1 Parking.40, ITPB Main Road, International Tech Park, Whitefield Main Rd, Pattandur Agrahara, Whitefield, Bengaluru, Karnataka 560066",12.98729992,77.73639679,DC Fast Charging,EV2,24-Jul,?12 k/Wh,"Wifi, Parking"
Forum Shantiniketan,Karnataka,bengaluru,"Whitefield Main Road, Hoodi, Thigalarapalya, Krishnarajapura, Bengaluru, Karnataka ",12.9892355,77.7279077,AC Fast Charging,EV1,24-Jul,?9 k/Wh,"Wifi, Parking"
The Bangalore Bakery,Karnataka,bengaluru,"No 30, Ground Floor, 1st Cross Road, Malleshwaram, ",12.9941754,77.57121,AC Fast Charging,EV1,24-Jul,?8 k/Wh,"No Wifi, No Parking"
Orion Mall,Karnataka,bengaluru,"Dr Rajkumar Road, Rajajinagar,",13.011065,77.554534,AC Fast Charging,EV1,24-Jul,?8 k/Wh,"Wifi, Parking"
"The Chocolate Room, Bangalore",Karnataka,bengaluru,"No 412, 4th G Main Road, 2nd Block, HRBR Layout, Kalyan Nagar,",13.022915,77.639338,DC Fast Charging,EV2,24-Jul,?12 k/Wh,Wifi
Turf Trident,Tamil Nadu,chennai,"56, Lakeview garden, Korattur",13.1221926,80.1890017,AC Fast Charging,EV1,24-Jul,?10 k/Wh,"No Wifi, No Parking"
The Smith's Cafe & bakery,Tamil Nadu,chennai,"Balaji Nagar 2nd Cross St, Balaji Nagar, Ponniammanmedu, Chennai, Tamil Nadu ",13.125599,80.2241501,DC Fast Charging,EV2,9:00 AM - 9:00 PM,?15 k/Wh,Parking
Decathlon Anubhava,Karnataka,bengaluru,"Survey No 78/10, A2, Bellary Road, Bangalore Airport Road, Chikkajala,",13.169102,77.632018,AC Fast Charging,EV1,24-Jul,?9 k/Wh,Wifi
Acre Bengaluru,Karnataka,bengaluru,"No 63 , International Airport Road, Meenugunte, Jala Hobli, Yelahanka, Taluk",13.189056,77.644524,DC Fast Charging,EV2,24-Jul,?11 k/Wh,"Wifi, Parking"
Ather Space Tirupati,Andhra Pradesh,tirupati,"Vedhavyasa Bhavan, AIR Bypass Road, Royal Nagar, Tirupati, Andhra Pradesh ",13.6226445,79.414697,AC Fast Charging,EV1,24-Jul,?8 k/Wh,"Wifi, Parking"
Hitech Motors,Andhra Pradesh,tirupati,"Kanigiri - Tirupathi Rd, SV Auto Nagar, Tirupati, Andhra Pradesh",13.6292765,79.4619883,DC Fast Charging,EV2,8:00 AM - 8:00 PM,?14 k/Wh,Parking
Bellad Towers,Karnataka,hubli,"Ground Floor Bannigida Stop, Gokul Rd ",15.351171,75.126191,AC Fast Charging,EV1,24-Jul,?7 k/Wh,"No Wifi, No Parking"
Ather Space Goa,Goa,goa,"Betim-Pomburpa Rd, Alto- Betim Porvorim, Penha de Franu, Goa",15.5230657,73.825913,DC Fast Charging,EV2,24-Jul,?13 k/Wh,Wifi
"UK 27, The Fern",Karnataka,Belgavi,"UK27, Fern, Ayodhya Nagar, Sadashiv Nagar, Belagavi",15.87491249,74.51340824,AC Fast Charging,EV1,24-Jul,?10 k/Wh,"Wifi, Parking"
Mama Panda,Andhra Pradesh,vijayawada,"Royal arcade, beside sweet magic , opp to dvmanor, MG Rd, Vijayawada, Andhra Pradesh ",16.4992397,80.6481963,DC Fast Charging,EV2,24-Jul,?12 k/Wh,"No Wifi, No Parking"
McDonalds,Maharashtra,Kolhapur,"Shop No 1C, Hissa No 1, Plot No 1/K1, next to Klin Fuel Technology, Sarnobatwadi Kolhapur Maharashtra 416004",16.6869187,74.2703805,AC Fast Charging,EV1,24-Jul,?8 k/Wh,Wifi
"Unique Automobiles, MIDC Shiroli",Maharashtra,Kolhapur,"S.No 592,H.No 4481 1st Stop MIDC Shiroli(P) Tal-Hatkanangale, Dist-Kolhapur-416122",16.753021,74.279095,DC Fast Charging,EV2,8:00 AM - 8:00 PM,?13 k/Wh,Parking
