name,state,city,address,latitude,longitude,Charging Type,Supported Vehicle Types,access hours,Pricing Information,Amenities
Purnima Sweet's,Maharashtra,nashik,"Takli Rd, opp Vishwabharti society, Swanand Society, Dwarka, Nashik, Maharashtra ",19.99627904,73.80335918,DC Fast Charging,EV2,24-Jul,?10 k/Wh,"No Wifi, No Parking"
AtherSpace Rajajinagar,Karnataka,bengaluru,"No. 0025 (Old no.1003), 59th C Cross, 4th M Block, Sriram Mandir, Dr.Rajkumar Road, Rajaji Nagar",12.982706,77.560699,AC Fast Charging,EV1,24-Jul,?8 k/Wh,"Wifi, Parking"
"Sangeetha Mobiles, HBR Layout",Karnataka,bengaluru,"No 54, 80 Feet Main Road, Next to Muthoot Finance, HBR Layout,",13.025618,77.629122,AC Fast Charging,EV1,24-Jul,?9 k/Wh,Parking
IDC Kitchen,Karnataka,bengaluru,"No 67, 80 Feet Road, KGEHBS Layout, Devasandra, RMV 2nd Stage, Armane Nagar,",13.028052,77.572997,AC Fast Charging,EV1,24-Jul,?7 k/Wh,"No Wifi, No Parking"
"Chai Kings, Porur",Tamil Nadu,chennai,"No - 1/128 Ground Floor, Truck Road Iyyappanthangal, Porur",13.0370409,80.1398795,AC Fast Charging,EV1,24-Jul,?8 k/Wh,"Wifi, Parking"
AtherSpace Hubli,Karnataka,hubli,"P. B. Road, Bhairidevarkoppa",15.387875,75.1016179,DC Fast Charging,EV2,24-Jul,?10 k/Wh,Wifi
Narahari Silk House,Andhra Pradesh,hyderabad,"18-6-828, Lal Darwaza Rd, Balagunj, Lal Darwaza South, Lal Darwaza, Hyderabad, Telangana ",17.34763,78.475397,AC Fast Charging,EV1,24-Jul,?9 k/Wh,Wifi
Pepper & Tarragon Club Caffe,Andhra Pradesh,hyderabad,"Opposite to Aparna Sarovar, Nalagandla, Telangana ",17.46377,78.3088,DC Fast Charging,EV2,24-Jul,?11 k/Wh,"Wifi, Parking"
BMC Market Bhandup ,Maharashtra,mumbai,"320, 3rd Floor, BMC Market, Station Road, Bhandup West, next to Dreamz Mall, Bhandup (W, Bhandup East, Mumbai, Maharashtra",19.14477582,72.93714663,AC Fast Charging,EV1,24-Jul,?8 k/Wh,"No Wifi, No Parking"
Charge Zone,Gujarat,Vapi,"GJ | Vapi |Shanti-Complex ,Shanti Complex, Beside King Ford Near Jalaram Temple, NH-8, Vapi, Gujarat 396191",20.38000422,72.914853,Vapi,"Shanti-Complex, Shanti Complex, Beside King Ford Near Jalaram Temple, NH-8, Vapi, Gujarat 396191",24-Jul,EV2,24-Jul
Tata Power ,Gujarat,Vapi,"Ginger Hotel, Salvav, Ginger Hotel Vapi Dream Honda, Opp. Empress Mall, NH-08, Salvav, Vapi, Gujarat-396191",20.414322,72.91809,AC Fast Charging,EV1,24-Jul,?9 k/Wh,Parking
Electric Vehicle Charging Station,Gujarat,NAVSARI,"WXV7+V74, Tighra, Navsari, Gujarat 396445",20.9455031,72.96504985,DC Fast Charging,EV2,24-Jul,?11 k/Wh,"Wifi, Parking"
VR Surat,Gujarat,surat,"Dumas Rd, Magdalla, Surat, Gujarat ",21.1451737,72.7569487,AC Fast Charging,EV1,24-Jul,?10 k/Wh,"No Wifi, No Parking"
"Shreeji Automart, Piplod",Gujarat,Surat,"04 A/B, Shreeji House,Opp. Big Bazar,Dumas Road, Piplod,Surat-395002",21.159829,72.770603,DC Fast Charging,EV2,24-Jul,?10 k/Wh,"Wifi, Parking"
"Pramukh Auto, Umiya Nagar",Gujarat,Surat,"Plot No. 409/27-A, Umiya Nagar Society,Near Chosath Jogni Mata Temple,Udhna Magdalla Road,Surat-394210",21.164948,72.835879,DC Fast Charging,EV2,24-Jul,?12 k/Wh,Wifi
Electric Vehicle Charging Station,Gujarat,Surat,"Block number 552-553 IRB Compound opp Mansarovar Residency NH 8 Kamrej, Surat 394185",21.221,72.8733,AC Fast Charging,EV1,24-Jul,?8 k/Wh,"No Wifi, No Parking"
Hotel swagat INN,Gujarat,Amboli,"94, NH 48, opp. Tata Motors, Amboli, Gujarat 394150",21.30157137,72.95378153,AC Fast Charging,EV1,24-Jul,?10 k/Wh,Parking
"Click Hotel, Junagadh",Gujarat,Junagadh,"Near Railway Station,Junagadh, Gujrat 362001",21.52840996,70.45845795,AC Fast Charging,EV1,24-Jul,?7 k/Wh,Wifi
"Hotel Suba Grand, Dahej",Gujarat,Bharuch,"jolva village , dahej, bharuch ,State Gujarat 392135",21.7164114,72.6562979,DC Fast Charging,EV2,24-Jul,?11 k/Wh,"Wifi, Parking"
"IOCL Kevadia, Garudeshwar",Gujarat,Kevadia,"Survey No u00e2u0080u0093 422, 423 Village u00e2u0080u0093 Kevadiya, Taluka u00e2u0080u0093 Garudeshwar District u00e2u0080u0093 Narmada, Gujarat, 393151",21.885704,73.688136,AC Fast Charging,EV1,24-Jul,?9 k/Wh,"No Wifi, No Parking"
"HONEST RESTAURANT NH8,MIYAGAM,MIYAGAM KARJAN,GUJARAT",Gujarat,KARJAN,"opposite bharthana village, near elentic tolnaka between baroda to bharuch, NH8, miyagam, Karjan, Gujarat 391240",22.02415767,73.11753277,DC Fast Charging,EV2,24-Jul,?10 k/Wh,"No Wifi, Parking"
"HONEST RESTAURANT NH8,MIYAGAM,MIYAGAM KARJAN,GUJARAT",Gujarat,KARJAN,"opposite bharthana village, near elentic tolnaka between baroda to bharuch, NH8, miyagam, Karjan, Gujarat 391240",22.0242,73.1175,DC Fast Charging,EV2,24-Jul,?10 k/Wh,"No Wifi, Parking"
"Parin Motors, NH8 Gondal Highway",Gujarat,Rajkot,"149, Plot No 2, Survey No, NH 8B, Gondal Highway, near Parin Furniture, Rajkot, Gujarat 360004",22.225264,70.801197,AC Fast Charging,EV1,24-Jul,?8 k/Wh,Wifi
"Jai Ganesh, Kothariya",Gujarat,Rajkot,"Jai Ganesh MG. Opp Krishna Park , Rajkot-Gondal Highway ,Kothariya, Rajkot-360003",22.227526,70.801092,AC Fast Charging,EV1,24-Jul,?9 k/Wh,"No Wifi, Parking"
Tata Power ,Gujarat,Rajkot,"IOCL Motamawa, Kalavad Road, Near Saraza, Opp Cosmoplex Cinema, Kalavad Rd, Rajkot, Gujarat 360005",22.269902,70.741577,DC Fast Charging,EV2,24-Jul,?12 k/Wh,"Wifi, Parking"
"IOCL Manjalpur, GIDC Rd Manjalpur",Gujarat,Vadodara,"312, GIDC Rd, Beside Om Pippadiya Hanumanji Mandir, Ghanshyam Nagar Society 2, Manjalpur, Vadodara, Gujarat 390011",22.271793,73.190795,AC Fast Charging,EV1,24-Jul,?7 k/Wh,"No Wifi, No Parking"
Comfort Inn Legacy By One Earth,Gujarat,Rajkot,"Comfort Inn Legacy By One Earth Panchnath Road, Limda Chowk, Rajkot Gujarat-360001",22.2967048,70.7991222,DC Fast Charging,EV2,24-Jul,?10 k/Wh,Parking
"Hotel Suba Elite, Fatehganj Main Road",Gujarat,Vadodara,"near Parsi Agiyari , Fatehganj Main Road, Vadodara u00e2u0080u0093 390 002 Gujarat 390002",22.3205834,73.1883779,AC Fast Charging,EV1,24-Jul,?8 k/Wh,Wifi
Z Charging Station,Gujarat,Vadodara,"Sai Vihar, Abbas Tyabji Rd, Jayesh Colony, Fatehgunj, Vadodara, Gujarat 390002",22.3213,73.1881,DC Fast Charging,EV2,24-Jul,?11 k/Wh,Wifi
"IOCL Omkar Petroleum, Subhanpura",Gujarat,Vadodara,"High Tension Rd, Subhanpura, Vadodara, Gujarat 390023",22.3216986,73.154986,AC Fast Charging,EV1,24-Jul,?7 k/Wh,"No Wifi, No Parking"
"ABC Autolink, NH 64 Ranoli",Gujarat,Vadodara,"No 1401, Ranoli GIDC, Vadodara, NH 64, Gujarat 391350",22.403828,73.13455,DC Fast Charging,EV2,24-Jul,?10 k/Wh,Wifi
Mindra D S Fasteners Charging Station,Gujarat,Rajkot,"National Highway 27 (8B), Opp. 80 ft. Road End, Opp. K.S. Diesels, Rajkot-360 003, Gujarat, India",22.473,70.895,AC Fast Charging,EV1,24-Jul,?9 k/Wh,Parking
Tata Power ,Gujarat,Ahmedabad,"IOCL Ashtavinayak Petroleum, Hirapur, Survey No.836, Hirapur Chaukadi, Village, Hirapur, Gujarat 382435",22.922329,72.711943,DC Fast Charging,EV2,24-Jul,?12 k/Wh,Wifi
"IOCL Om Petroleum, Kamod",Gujarat,Kamod,"Kamod, Gujarat 382427",22.9247437,72.5434955,AC Fast Charging,EV1,24-Jul,?8 k/Wh,"No Wifi, No Parking"
"IOCL - Sardar Petro Station, Bakrol",Gujarat,Ahmedabad,"M/s Sardar Petrol Station, Near Toll Plaza Ring Road, Bakrol-Bardrabad, Daskroi, Ahmedabad-382433",22.935404,72.520954,DC Fast Charging,EV2,24-Jul,?10 k/Wh,Wifi
"IOCL Laxmi Narayan Petroleum, Changodar",Gujarat,Changodar,"National Highway 8A, Changodar, Gujarat 382210",22.9378139,72.455668,AC Fast Charging,EV1,24-Jul,?7 k/Wh,"No Wifi, Parking"
Tata Power ,Gujarat,Ahmedabad,"Yash Motors, Narol, Opp mayauri trading company, near asopalav hotel, narol cross road, narol - pin - 382405",22.973461,72.582288,AC Fast Charging,EV1,24-Jul,?8 k/Wh,"No Wifi, No Parking"
MG AHMEDABAD MAKARBA,Gujarat,AHMEDABAD,"PLOT NO 2,GROUND FLOOR,SURVEY NO 841/1 AND 2,10,SIGNATURE 1 ,NEAR OLD RAILWAY LINE,SG HIGHWAY,MAKARBA,GUJARAT 3850051 AHMEDABAD",22.996681,72.498226,DC Fast Charging,EV2,24-Jul,?11 k/Wh,Wifi
Mindra Crispy Culture AC Charging Station,Gujarat,Ahmedabad,"Narayan Nagar Society, Narayan Nagar, Ahmedabad, Gujarat 380007",22.9989,72.5594,AC Fast Charging,EV1,24-Jul,?9 k/Wh,Parking
COCO Vejalpur Ahmedabad,Gujarat,Ahmedabad,"Next to Sachin Towers, shyamal Cross Roads, Anand nagar Cross Roads, Ahmedabad, Gujrat",23.01303861,72.52421557,DC Fast Charging,EV2,24-Jul,?12 k/Wh,Wifi
"Progressive Cars, SG Highway",Gujarat,Ahmedabad,"G-9, Shapath V, Beside Hotel Crowne Plaza, Near Karnavati Club , SG Highway, Ahmedabad, Gujarat  - 380015",23.014261,72.503947,AC Fast Charging,EV1,24-Jul,?9 k/Wh,"No Wifi, Parking"
Mindra Polar International AC Station,Gujarat,Ahmedabad,"Rahul Tower, 4,Vraj Vihar -6 B/H, Prernatirth Derasar Rd, Satellite, Ahmedabad, Gujarat 380015",23.0158,72.5178,AC Fast Charging,EV1,24-Jul,?8 k/Wh,Wifi
"Riya Autolink, Ambli BRTS Bus Stand",Gujarat,Ahmedabad,"Near Devkutir Bunglow, Opp Bopal Ambli BRTS Bus Stand, Iscon-Bopal Road, Ahmedabad, Gujarat - 380058",23.02558,72.47991,AC Fast Charging,EV1,24-Jul,?8 k/Wh,"No Wifi, No Parking"
"Westside, Ellisbridge",Gujarat,Ahmedabad,"Ground Floor, Abhijeet V, Netaji Rd Ellisbridge Opp. Mayor Bungalow, Ellisbridge, Ahmedabad, Gujarat 380006",23.02938,72.56142,AC Fast Charging,EV1,24-Jul,?10 k/Wh,Parking
"HP Autocare , Bodakdev",Gujarat,Ahmedabad,"JUDGES BUNGALOW ROAD, T VILLAGE : BODAKDEV , CITY : AHMEDABAD 380054",23.0332201,72.5137528,DC Fast Charging,EV2,24-Jul,?11 k/Wh,Wifi
Tata Power ,Gujarat,Ahmedabad,"Riya Autolink, Bodakdev, Near Rajpath Club,SG Highway,Ahmedabad,Gujarat-380054",23.03577,72.51,AC Fast Charging,EV1,24-Jul,?10 k/Wh,"No Wifi, No Parking"
"Ahmedabad One Mall, Vastrapur",Gujarat,Ahmedabad,"Plot No. 216, T. P. Scheme 1, Near Vastrapur Lake, Vastrapur, Ahmedabad u00e2u0080u0093 380054 ",23.0397522,72.5318124,DC Fast Charging,EV2,24-Jul,?12 k/Wh,Wifi
Mindra EV Charger Shott,Gujarat,Shela,"Shott, Sindhu Bhavan Marg, Opposite Saket-3, Next to SANKALP SQUARE, PRL Colony, Thaltej, Ahmedabad, Gujarat 380059",23.0436,72.4825,AC Fast Charging,EV1,24-Jul,?8 k/Wh,Wifi
Shree Siddhi Vinayak Indian Oil Petrol Pump,Gujarat,Ahmedabad,"Shree Siddhi Vinayak Indian Oil Petroleum Judges Bangla, Satya Marg, Bodakdev, Ahmedabad, Gujrat",23.04430424,72.51767735,AC Fast Charging,EV1,24-Jul,?9 k/Wh,"No Wifi, Parking"
"Ginger Vastrapur, Drive In Road",Gujarat,Ahmedabad,"Behind Himalaya Mall, Drive In Road, Ahmedabad - 380015",23.04626,72.53069,DC Fast Charging,EV2,24-Jul,?10 k/Wh,Wifi
Tata Power ,Gujarat,Ahmedabad,"Ginger Hotel, DriveIn Road, Ginger Hotel Ahmedabad Behind Himalaya Mall, DriveIn Road, Ahmedabad 380015",23.047141,72.531013,DC Fast Charging,EV2,24-Jul,?12 k/Wh,Parking
"Fairfield by Marriott, Ashram Rd",Gujarat,Ahmedabad,"Ashram Rd, Satyawadi Society, Usmanpura, Ahmedabad, Gujarat 380013",23.0522787,72.5710882,AC Fast Charging,EV1,24-Jul,?10 k/Wh,"No Wifi, No Parking"
Abhinav Girls Hostel Bodakdev,Gujarat,Ahmedabad,"Bodakdev, Ahmedabad, Gujarat 380054",23.058,72.5001,AC Fast Charging,EV1,24-Jul,?10 k/Wh,"Wifi, Parking"
"HP Service Center, Sola ",Gujarat,Ahmedabad,"F.P. No 232/1, Solaroad, Ahmedabad 380061",23.0633903,72.5317625,AC Fast Charging,EV1,24-Jul,?12 k/Wh,Parking
Tata Power ,Gujarat,Ahmedabad,"EV Capital Ram Nagar, Sabarmati, 3HGQ+QV6, Ram Nagar, Sabarmati, Ahmedabad, Gujarat,380005",23.076996,72.5896645,DC Fast Charging,EV2,24-Jul,?15 k/Wh,Wifi
"Click Hotel, Bhuj",Gujarat,Bhuj,"opp. Bhuj railway compound,Bhuj, Gujarat 370001",23.2655334,69.6786728,AC Fast Charging,EV1,24-Jul,?10 k/Wh,Parking
"The Hazelnut Factory, Alambagh",Gujarat,lucknow,"LGF & UGF RB Tower, B-172, Kanpur Rd, Behind iDelta | Phoenix Mall, Lucknow, Lucknow, Uttar Pradesh 226005",26.7991124,80.8982589,"Phoenix Mall, Lucknow, Lucknow, Uttar Pradesh 226005",DC Fast Charging,24-Jul,24-Jul,?12 k/Wh
The Hazelnut Factory,Gujarat,lucknow,"B 192, Niralanagar, Lucknow - 226020",26.8727547,80.9407119,AC Fast Charging,EV1,24-Jul,?10 k/Wh,"No Wifi, No Parking"
Oyo Silverkey 42750,Gujarat,gurugram,"170, Medicity, Islampur Colony, Sector 38,  Gurugram",28.434959,77.0442743,DC Fast Charging,EV2,24-Jul,?14 k/Wh,Wifi
Amrit Residency,Gujarat,gurugram,"Opposite Ayyappa Temple, Dundahera, Surya Vihar, Sector 21, Gurugram",28.5184277,77.0719022,AC Fast Charging,EV1,24-Jul,?11 k/Wh,"Wifi, Parking"
Sarath City Capital Mall,Andhra Pradesh,hyderabad,"Capital Mall, GF-070 & 071, Sarath City, Gachibowli - Miyapur Rd, Forest Dept Colony, Kondapur, Hyderabad, Telangana ",17.456842,78.364575,DC Fast Charging,EV2,24-Jul,?13 k/Wh,Wifi
"Breadworld, Petta",Kerala,kochi,"50/698 pushpamangalam Heritage, petta Maradu Road Near Gandhi Square",9.9449301,76.3354211,AC Fast Charging,EV1,24-Jul,?9 k/Wh,Parking
"Host The Hospitality Store (Breadworld, Thykoodam)",Kerala,kochi,"Thykoodam Service Rd, Vyttila,  Thykoodam, Kochi,  Kerala ",9.96185112,76.31884766,AC Fast Charging,EV1,24-Jul,?8 k/Wh,"No Wifi, No Parking"
"Breadworld, Mavelipuram",Kerala,kochi,"7/5 1 6- 1, 2, 3,  Seaport u2013 Airport Rd, Mavelipuram, Kakkanad, Kerala ",10.0231762,76.3411644,AC Fast Charging,EV1,24-Jul,?9 k/Wh,"Wifi, Parking"
"Ather Space, Kozhikode",Kerala,calicut,"MCC Cross Rd, Vellayil, Kozhikode, Kerala ",11.264453,75.7773662,DC Fast Charging,EV2,24-Jul,?12 k/Wh,"Wifi, Parking"
Lumber Jack,Maharashtra,pune,"TechKaTech Innovation Hub, Karve road, Opp to Vandevi Temple, above Hotel Marathi Bana, Mavale Basti, Hingne Budrukh, Karve Nagar, Pune, Maharashtra ,Karve Nagar",18.49311528,73.81548659,AC Fast Charging,EV1,24-Jul,?11 k/Wh,"No Wifi, No Parking"
AtherSpace Pune,Maharashtra,pune,"805, Bhandarkar Rd, Below Kung Apartments, Deccan Gymkhana, Pune, Maharashtra ",18.5186726,73.8302965,DC Fast Charging,EV2,24-Jul,?12 k/Wh,Wifi
Lodha Venezia CPL,Maharashtra,mumbai,"GD Ambekar Marg, Lal Baug, Parel, Mumbai, Maharashtra",18.9917205,72.841513,AC Fast Charging,EV1,24-Jul,?10 k/Wh,"Wifi, Parking"
Volltic DCS03,Haryana,Gurgaon,"Baba mallah plot, near lakshya tent house, village wazirabad, sector 52, gurgaon, haryana",28.25547179,77.05044021,DC Fast Charging,EV2,24-Jul,?14 k/Wh,"No Wifi, No Parking"
AARGO GOLDEN GALAXY HOTEL,Haryana,FARIDABAD,"NH-19, Ballabhgarh, Faridabad, Haryana 121004",28.288075,77.295116,AC Fast Charging,EV1,24-Jul,?13 k/Wh,"Wifi, Parking"
AARGO GOLDEN GALAXY HOTEL,Haryana,FARIDABAD,"NH-19, Ballabhgarh, Faridabad, Haryana 121004",28.288075,77.295116,AC Fast Charging,EV1,24-Jul,?13 k/Wh,"Wifi, Parking"
Tata Power ,Haryana,Faridabad,"AutoVikas, Sec -5, Plot no-2 Sector- 5 North India Compound, 20/3, Mathura Road Faridabad-121005",28.3628,77.314851,DC Fast Charging,EV2,24-Jul,?15 k/Wh,"No Wifi, No Parking"
Karma Lakelands AC Charger,Haryana,Gurugram,"Karma Lakeland, NH-8, Sector 80, Gurugram, Haryana 122002",28.3639,76.9607,AC Fast Charging,EV1,24-Jul,?11 k/Wh,Wifi
Savoy Suites Manesar,Haryana,Gurugram,"R 75, Sector 1 Main Rd, Sector 1, Imt Manesar, Gurugram, Haryana 122051",28.3664,76.9436,AC Fast Charging,EV1,24-Jul,?10 k/Wh,"No Wifi, No Parking"
Monsoon Breeze AdPod,Haryana,Gurugram,"K tower, Gurgaon sector 78, Gurgaon - 122004",28.3687,76.966,AC Fast Charging,EV1,24-Jul,?9 k/Wh,"Wifi, Parking"
Volltic HR001,Haryana,Gurgaon,"Plot No u0096 283, Sector u0096 7, IMT Manesar, Gurugram, Haryana 122050",28.37480792,76.91054184,DC Fast Charging,EV2,24-Jul,?13 k/Wh,Wifi
Deep Brothers IOCL AC Charging Station,Haryana,Darbaripur,"Deep Brothers, Palra Road, Darbaripur",28.3861,77.0063,AC Fast Charging,EV1,24-Jul,?10 k/Wh,"No Wifi, No Parking"
Tata Power ,Haryana,Gurgaon,"Vatika Town Square II, Sector 82, Sector 82, Vatika India Next, Haryana -122004",28.3904593,76.9592003,DC Fast Charging,EV2,24-Jul,?12 k/Wh,"No Wifi, No Parking"
Volltic PCS01,Haryana,Gurgaon,"285, Baharampur Naya Marg, Baharampur Naya, Sector 61, Gurugram, Haryana 122011",28.40501523,77.09266673,DC Fast Charging,EV2,24-Jul,?13 k/Wh,Wifi
Volltic DCS04,Haryana,Gurgaon,"Vatika City, Block W, sector 49, gurgaon, Haryana",28.40596414,77.04509603,AC Fast Charging,EV1,24-Jul,?12 k/Wh,Parking
Tata Power ,Haryana,Gurgaon,"Zedex TATA, Sec 48, GF-26, NIHO Scottish Mall, Sector 48, P.S. - Badshahpur, District - Gurugram 122001",28.411072,77.040546,DC Fast Charging,EV2,24-Jul,?14 k/Wh,"Wifi, Parking"
The Nile AdPod,Haryana,Gurgaon,"The Nile, Sohna, Gurgaon - Delhi Expy, Rosewood City, Ghasola, Sector 49, Gurugram, Haryana 122018",28.4113,77.051,AC Fast Charging,EV1,24-Jul,?10 k/Wh,"No Wifi, No Parking"
Mahindra first choice ,Haryana,Gurgaon,"PLOT NO-21,SECTOR-61, near HBR CHOWK, Gurugram, Haryana 122005",28.42061615,77.10537261,AC Fast Charging,EV1,24-Jul,?10 k/Wh,Parking
Volltic DCS05,Haryana,Gurgaon,"Building no. 9, Candor TechSpace, IT/ITES SEZ, Tikri, Sector 48, Gurugram, Haryana 122018",28.42487691,77.03101261,DC Fast Charging,EV2,24-Jul,?12 k/Wh,Wifi
Uniworld Garden Charging Station,Haryana,Gurugram,"Plot No 1025, 2nd Floor, C block , sector 47, Haryana 122008",28.4273,77.0389,AC Fast Charging,EV1,24-Jul,?11 k/Wh,Wifi
JMD Gardens,Haryana,Gurugram,"Unnamed Road, Sector 33, Gurugram, Haryana 122018",28.4336,77.0349,AC Fast Charging,EV1,24-Jul,?10 k/Wh,Parking
"DLF - The Crest, Sec 43",Haryana,Gurgaon,"DLF Phase 5, Sector 43, Gurugram, Haryana 122002",28.4438196,77.1117253,AC Fast Charging,EV1,24-Jul,?10 k/Wh,"Wifi, Parking"
Volltic DCS011,Haryana,Gurgaon,"Institutional Area, Sector 32, Gurugram, Haryana 122018",28.44588294,77.04060087,DC Fast Charging,EV2,24-Jul,?13 k/Wh,"Wifi, Parking"
IOCL Chahar AC Charging Station,Haryana,Gurugram,"Basai Rd, Vikas Nagar, Sector 9, Gurugram, Haryana 122018",28.456,77.001,AC Fast Charging,EV1,24-Jul,?10 k/Wh,"No Wifi, No Parking"
Park Plaza Gurgaon DC Charging Station,Haryana,Gurugram,Unknown,28.4597,77.0758,DC Fast Charging,EV2,24-Jul,?14 k/Wh,Wifi
MG GURGAON SECTOR 15,Haryana,GURUGRAM,"32,MILESTONE,EXPERION CENTER,SECTOR 1,NH-8,HARYANA 122001 GURUGRAM",28.462298,77.048472,AC Fast Charging,EV1,24-Jul,?10 k/Wh,"Wifi, Parking"
WeWork Circle Demo,Haryana,Gurugram,"4th Floor, The Galaxy Hotel, Behind 32nd Milestone Off NH 8, Sector 15, Gurugram, Haryana 122001",28.4632,77.049,AC Fast Charging,EV1,24-Jul,?12 k/Wh,"Wifi, Parking"
Galleria DC Charging Station,Haryana,Gurugram,"DLF Phase IV, Sector 28, Gurugram, Haryana 122022",28.4673,77.0818,DC Fast Charging,EV2,24-Jul,?10 k/Wh,"Wifi, Parking"
"Vatika City Point, Sec 25",Haryana,Gurgaon,"Mehrauli-Gurgaon Rd, Heritage City, Sector 25, Gurugram, Haryana 122002",28.4811468,77.0831202,AC Fast Charging,EV1,24-Jul,?8 k/Wh,Parking
Heritage City AC Charging Station,Haryana,Gurugram,"Heritage City 581-600 Flats, Heritage City, Sector 25, Gurugram, Haryana 122022",28.4823,77.0766,AC Fast Charging,EV1,24-Jul,?9 k/Wh,"Wifi, Parking"
DLF Gateway Charging Station,Haryana,Gurgaon,"IndusInd Metro Station, DLF Cyber City, DLF Phase 2, Sector 24, Gurugram, Haryana 122022",28.49807984,77.09116915,DC Fast Charging,EV2,24-Jul,?12 k/Wh,Wifi
Unger India pvt India,Haryana,GURUGRAM,"71, Udyog Vihar Phase 1, Udyog Vihar, Sector 19, Gurugram, Haryana 122016",28.499,77.08356,AC Fast Charging,EV1,24-Jul,?10 k/Wh,Parking
Statiq RnD Centre AC Charging Station,Haryana,Gurgaon,"Statiq RnD Centre, Plot 80A, Phase V, Udyog Vihar, Sector 19, Gurugram, Haryana 122017",28.4997,77.0839,AC Fast Charging,EV1,24-Jul,?9 k/Wh,"Wifi, Parking"
Statiq RnD Centre DC Charging Station,Haryana,Gurgaon,"Statiq RnD Centre, Plot 80A, Phase V, Udyog Vihar, Sector 19, Gurugram, Haryana 122017",28.4997,77.0839,DC Fast Charging,EV2,24-Jul,?13 k/Wh,Parking
New Udaan Bhawan AdPod 1,Haryana,Gurgaon,Indira Gandhi International Airport,28.553,77.0944,DC Fast Charging,EV2,24-Jul,?15 k/Wh,"Wifi, Parking"
New Udaan Bhawan AdPod 2,Haryana,Gurgaon,Indira Gandhi International Airport,28.5537,77.0943,DC Fast Charging,EV2,24-Jul,?15 k/Wh,"Wifi, Parking"
Athergrid CP,Delhi,delhi,"A 221 road no 6, D Block, Connaught Place, New Delhi, 110037",28.633714,77.221904,AC Fast Charging,EV1,24-Jul,?11 k/Wh,"Wifi, Parking"
Woods Cafe Indira Priyadarshani Park,Uttar Pradesh,ghaziabad,"Indira Priyadarshani Park, Arthla, Mohan Nagar, Ghaziabad, Uttar Pradesh 201001",28.6749316,77.3982382,AC Fast Charging,EV1,24-Jul,?9 k/Wh,Parking
"Daisy Motors, TML - CV, Hisar",Haryana,Hisar,"Daisy Motors, 12th KM Stone, Delhi-Hisar Bypass, Road, Hisar - 125001",29.1259617,75.8027817,AC Fast Charging,EV1,24-Jul,?8 k/Wh,Parking
Ganpati Petro DC Charging Station Hisar,Haryana,Sangli,"Ganpati Petro, Indian Oil Corporation, Opp. Vidut Nagar, Delhi Road, Industrial Area, Hisar, Haryana 125011",29.1332,75.7535,DC Fast Charging,EV2,24-Jul,?14 k/Wh,"Wifi, Parking"
Ganpati Petro AC Charging Station Hisar,Haryana,Sangli,"Ganpati Petro, Indian Oil Corporation, Opp. Vidut Nagar, Delhi Road, Industrial Area, Hisar, Haryana 125011",29.1332,75.7535,AC Fast Charging,EV1,24-Jul,?9 k/Wh,Wifi
"SNEH DHABA, NH 1 Ganaur",Haryana,Ganaur,"64th Milestone, NH-1, Ganaur, Sonipat, Haryana 131101",29.157569,77.035833,AC Fast Charging,EV1,24-Jul,?7 k/Wh,"No Wifi, No Parking"
Mehak Garden Charging Station,Haryana,Sirsa,"National Highway 10, Sirsa, Haryana 125055",29.528,75.1325,AC Fast Charging,EV1,24-Jul,?8 k/Wh,Wifi
Neelkanth Star DC Charging Station,Haryana,Gurugram,"Neelkanth Star Karnal, NH 44, Gharunda, Kutail, Haryana 132114 ",29.6019,76.9803,DC Fast Charging,EV2,24-Jul,?12 k/Wh,Parking
Neelkanth Star AC charging  station,Haryana,karnal,"Neelkanth Star Karnal, NH 44, Gharunda, Kutail, Haryana 132114 ",29.6019,76.9803,AC Fast Charging,EV1,24-Jul,?9 k/Wh,"Wifi, Parking"
"IOCL Royal Petro, NH 44",Haryana,Karnal,"NH 44, Near The Royal Paradise Resort , Karnal- 132001",29.731581,76.976511,AC Fast Charging,EV1,24-Jul,?8 k/Wh,"Wifi, Parking"
SG Karnal DC Charging Station,Haryana,Karnal,"131 km Milestone, G. T, GT Karnal Rd, near Karna Lake, Karnal, Haryana 132001",29.7379,76.9756,DC Fast Charging,EV2,24-Jul,?12 k/Wh,"Wifi, Parking"
SG Karnal AC Charging Station,Haryana,Karnal,"131 km Milestone, G. T, GT Karnal Rd, near Karna Lake, Karnal, Haryana 132001",29.7379,76.9756,AC Fast Charging,EV1,24-Jul,?9 k/Wh,Wifi
Aman Hotel Kurukshetra DC Charging Station,Haryana,Shabhad," NH-1, GT Karnal Road, Shahabad Markanda, Shahabad, Haryana, 136135",30.2059,76.8575,DC Fast Charging,EV2,24-Jul,?11 k/Wh,Wifi
HAREDA EESL Panchkula,Haryana,Panchkula,"HAREDA, Akshay Urja Bhawan , Institutional plot No.1 Sector-17 Panchkula , 134109 Haryana",30.695929,76.834874,AC Fast Charging,EV1,24-Jul,?9 k/Wh,Parking
HAREDA EESL Panchkula,Haryana,Panchkula,"HAREDA, Akshay Urja Bhawan , Institutional plot No.1 Sector-17 Panchkula , 134109 Haryana",30.695929,76.834874,AC Fast Charging,EV1,24-Jul,?9 k/Wh,Wifi
HAREDA EESL Panchkula,Haryana,Panchkula,"Akshay Urja Bhawan, Plot No-1, Sector 17, Opp Agarwal Bhavan, Panchkula, Haryana 134109",30.76862873,76.85381552,AC Fast Charging,EV1,24-Jul,?9 k/Wh,"Wifi, Parking"
SG Jabli DC Charging Station,Himachal Pradesh,Kasauli,"VPO - Jabli, NH-22, Teh, Kasauli, Himachal Pradesh",30.879,76.9948,DC Fast Charging,EV2,24-Jul,?14 k/Wh,"No Wifi, No Parking"
SG Jabli  AC Charging Station,Himachal Pradesh,Kasauli,"VPO - Jabli, NH-22, Teh, Kasauli, Himachal Pradesh",30.879,76.9948,AC Fast Charging,EV1,24-Jul,?9 k/Wh,Wifi
"IOCL - Tapan Auto, NH 22",Himachal Pradesh,Barog,"National Highway 22, Beside Tapan, Barog, Himachal Pradesh 173211",30.8873188,77.0879411,AC Fast Charging,EV1,24-Jul,?9 k/Wh,"No Wifi, No Parking"
Krishna Hansraj Hotel Una DC charging station ,Himachal Pradesh,Una,"Old Hoshiarpur Rd, Una, Himachal Pradesh 174303",31.4668,76.2568,DC Fast Charging,EV2,24-Jul,?13 k/Wh,"Wifi, Parking"
Suket Cafe DC Charging Station Sundar Nagar,Himachal Pradesh,Gajraula,"Suket Cafe, Pungh, National Highway 21, Sundar Nagar, Himachal Pradesh 175018",31.5153,76.8765,DC Fast Charging,EV2,24-Jul,?14 k/Wh,"Wifi, Parking"
Suket Cafe AC Charging Station Sundar Nagar,Himachal Pradesh,Sundar Nagar,"Suket Cafe, Pungh, National Highway 21, Sundar Nagar, Himachal Pradesh 175018",31.5153,76.8765,AC Fast Charging,EV1,24-Jul,?9 k/Wh,Parking
"Daisy Motors, TML - CV, Hisar",Haryana,Hisar,"Daisy Motors, 12th KM Stone, Delhi-Hisar Bypass, Road, Hisar - 125001",29.1259617,75.8027817,AC Fast Charging,EV1,24-Jul,?8 k/Wh,Parking
"Croma, Ramanthapur",Andhra Pradesh,Hyderabad,"Croma, Unit No. 2 & 3, Ground Floor, Plot Survey No. 46, Pragathi Nagar, Ramanthapur Main Road, Ramanthapur, Telangana, Hyderabad - 500013",17.499345,78.541866,AC Fast Charging,EV1,24-Jul,?10 k/Wh,"Wifi, Parking"
Chai Kahani - Sainikpuri,Andhra Pradesh,hyderabad,"colony, 1st Cross Vayupuri, Verka Residency, Vayupuri, Sainikpuri",17.486819,78.5431269,AC Fast Charging,EV1,24-Jul,?9 k/Wh,Parking
"Mr. Lalit Jenau00e2u0080u0098s Site, Panikoili",Rajasthan,Jajpur,"Beside Prasanta Filling Station(BPCL), Plot 1632, Mouza, Baliposi, PO: Baliposi, PS: Sathipur, Panikoili District, Jajpur 755025",20.9238315,86.2494284,DC Fast Charging,EV2,24-Jul,?15 k/Wh,Wifi
Miramar Residency - Blive,Goa,goa,"Miramar Beach, Miramar, Panaji, Goa",15.4845196,73.8091218,AC Fast Charging,EV1,24-Jul,?10 k/Wh,Wifi
Kotak Mahindra Bank,Madhya Pradesh,indore,"580, Mahatma Gandhi Rd, near Indraprastha Tower, Infront of, Race Course Road, Indore, Madhya Pradesh ",22.7229189,75.8793613,AC Fast Charging,EV1,24-Jul,?9 k/Wh,Wifi
Tata Power ,Jammu,Jammu,"Le ROI, Jammu, Railway Station, Jammu, Jammu & Kashmir - 180003",32.7064117,74.8792033,AC Fast Charging,EV1,24-Jul,?10 k/Wh,Wifi
Detailing Bull,Haryana,gurugram,"F7, Shushant Lok 2 Near Hong Kong Bazar, Sector 57, Gurugram, Haryana 122011",28.4195244,77.0885144,AC Fast Charging,EV1,24-Jul,?8 k/Wh,Parking
"Arise Autoz, Narwal Byepass",Jammu & Kashmir,Jammu,"Arise Autoz Pvt Ltd, Mailk Market , Narwal Byepass Jammu-180016",32.70661,74.89568,DC Fast Charging,EV2,24-Jul,?12 k/Wh,"Wifi, Parking"
"Asia One Earth, Jammu Tawi",Jammu & Kashmir,Jammu,"Asia One Earth, Jammu Tawi, Nehru Market, Jammu tawi, Jammu & Kashmir-180004",32.713043,74.8598406,AC Fast Charging,EV1,24-Jul,?10 k/Wh,"Wifi, Parking"
Hotel Prabhat Palace DC Charging Station,Jammu and Kashmir,Katra,"Jammu Road, Katra Ro - 182301",32.9899,74.9255,DC Fast Charging,EV2,24-Jul,?10 k/Wh,"Wifi, Parking"
"Ather Space, Palakkad",Kerala,palakkad,"KVR Green Energy Pvt Ltd , TS2 Ventures , Mercy College Junction",10.770167,76.637861,AC Fast Charging,EV1,24-Jul,?7 k/Wh,Wifi
