name,state,city,address,latitude,longitude,Charging Type,Supported Vehicle Types,access hours,Pricing Information,Amenities
Rani Bagh Resort DC Charging Station,Rajasthan,Beawar Khas,"Rani Bagh Resort, N.H.8, By Pass Ajmer Road, Beawar, Rajasthan 305901",26.125,74.3459,DC Fast Charging,EV2,24-Jul,?9 k/Wh,Parking
Ather Service Centre,Rajasthan,guwahati,"House No 20,Janapath Lane,Ulubari",26.170766,91.7608176,AC Fast Charging,EV1,24-Jul,?11 k/Wh,"No Wifi, Parking"
JhalamandGarh Jodhpur,Rajasthan,Jodhpur,"Post Office Jhalamand, Jodhpur, Rajasthan 342005",26.20977,73.0650083,AC Fast Charging,EV1,24-Jul,?10 k/Wh,"No Wifi, No Parking"
Tata Power ,Rajasthan,Ajmer,"Mudgal Motors, Parbatpura, Mudgal motors, Jaipur Road Bypas, Parbatpura, Ajmer Rajasthan -305002",26.409926,74.661819,AC Fast Charging,EV1,24-Jul,?14 k/Wh,"Wifi, Parking"
Tata Power Charging Station,Rajasthan,Ajmer,"Ratanzila, Sedariya, Ajmer, Rajasthan 305025",26.43122843,74.68798808,DC Fast Charging,EV2,24-Jul,?7 k/Wh,"No Wifi, Parking"
The Westin Pushkar AC Charger,Rajasthan,Pushkar,"The Westin Pushkar Resort & Spa, Khasra No. 1242 1243, 1196/1726, Village Surajkund, Motisar Rd, Pushkar, Rajasthan 305022",26.4547,74.5046,AC Fast Charging,EV1,24-Jul,?8 k/Wh,Wifi
"Bravia Hotel, Vaishali Nagar",Rajasthan,Ajmer,"Bravia Hotel, Vaishali Nagar, near Urban Haat, Rajasthan 305004",26.487745,74.6293164,DC Fast Charging,EV2,24-Jul,?13 k/Wh,"Wifi, Parking"
"First Mobital, Tonk Road",Rajasthan,Jaipur,"G1-211, Sitapura Industrial Area, behind genpect Tonk Road, Jaipur - 302022",26.7775967,75.8392813,DC Fast Charging,EV2,24-Jul,?11 k/Wh,"No Wifi, Parking"
Crowne Plaza Jaipur,Rajasthan,Jaipur,"Plot No SP 1, Sitapura Industrial Area, Tonk Road, Jaipur, Rajasthan, 302022 ",26.7797,75.8282,AC Fast Charging,EV1,24-Jul,?9 k/Wh,"Wifi, Parking"
Trimurtys Ariana AC Charging Station,Rajasthan,Jaipur,"Trimurtys Ariana, Khasara No 211-213, Sector 30, Ramnagaria, Tehsil, Sanganer, JDA Colony, Jagatpura, Jaipur, Rajasthan 302017",26.8312,75.8663,AC Fast Charging,EV1,24-Jul,?10 k/Wh,"No Wifi, Parking"
"GPS Automobiles, Tonk Road",Rajasthan,Jaipur,"Plot No. 2& 3/4, Choudhary Charan Singh Colony, Tonk Road, Jaipur, 302029",26.833144,75.7951,DC Fast Charging,EV2,24-Jul,?12 k/Wh,Wifi
"Four Points By Sheraton, Tonk Road",Rajasthan,Jaipur,"No. 1, City Square, Vasundhara Colony, Tonk Road, Jaipur, Rajasthan, 302016",26.8643722,75.7957703,AC Fast Charging,EV1,24-Jul,?15 k/Wh,Wifi
"Anandi diesel - Reliance Jio True Power Electric vehicle car charger, EV charging station contractor",Rajasthan,Jaipur,"400 Feet SEZ Plot no 201-B, settlement road, Jaipur, Ramchandpura, Rajasthan 302026",26.85384707,75.63777481,DC Fast Charging,EV2,24-Jul,?10 k/Wh,"No Wifi, Parking"
Tata Power ,Rajasthan,Jaipur,"Clarks Collection, Govindpuri, 18, New Sanganer Rd, RoopVihar, Goverdhan Colony, Shiva Colony, Govindpuri, Jaipur, Rajasthan 302019",26.88776,75.7680401,AC Fast Charging,EV1,24-Jul,?9 k/Wh,Wifi
"Click Hotel, Raja Park",Rajasthan,Jaipur,"Udai Marg, Raja Park, Jaipur, Rajasthan 302007",26.8923514,75.8257073,DC Fast Charging,EV2,24-Jul,?14 k/Wh,Parking
"Roshan Motors, Adarsh Nagar",Rajasthan,Jaipur,"No B, 7, Govind Marg, Saket Colony, Adarsh Nagar, Jaipur, Rajasthan 302004",26.9013221,75.8354512,AC Fast Charging,EV1,24-Jul,?13 k/Wh,"No Wifi, No Parking"
"Ginger Hotel, Civil Lines",Rajasthan,Jaipur,"Ginger Hotel Jaipur Geejgarh House, Civil Lines, Hawa Sadak, Jaipur 302006 Tel: 0141 4666 333",26.9013484,75.7850126,AC Fast Charging,EV1,24-Jul,?8 k/Wh,Wifi
Statiq Charging Station,Rajasthan,Jaipur,"F-1, Amrapali Marg, Block C, Vaishali Nagar, Jaipur, Rajasthan 302021",26.91233473,75.74315015,DC Fast Charging,EV2,24-Jul,?10 k/Wh,"Wifi, Parking"
"Umaid Lake Resort, Kalakho ",Rajasthan,Dausa,"Karuna Enterprises kalakho (Umaid Lake Palaceu00c2u00a0 Village post Kalakho, NH 21 District Dausa, Rajasthan-303304",26.912864,76.466964,AC Fast Charging,EV1,24-Jul,?11 k/Wh,Parking
Tata Power ,Rajasthan,Jaipur,"Akar Fourwheels, Jhotwara, Niwaru Rd, Kumasiya, Shivaji Nagar, Jhotwara, Jaipur, Rajasthan 302012",26.9142719,75.7533201,DC Fast Charging,EV2,24-Jul,?9 k/Wh,Wifi
Statiq Electric Vehicle Charging Station,Rajasthan,Jaipur,"A-36 Basant Vihar, Vaishali Marg W, Panchyawala, Jaipur, Rajasthan 302034",26.91701887,75.72604692,DC Fast Charging,EV2,24-Jul,?13 k/Wh,Wifi
"Click Collection, Sindhi Camp",Rajasthan,Jaipur,"Plot No 1, 2, opposite Polovictory Cinema, Sindhi Camp, Jaipur, Rajasthan 302001",26.9206169,75.7975173,AC Fast Charging,EV1,24-Jul,?12 k/Wh,"No Wifi, Parking"
"Shree Shyam Motors, VKI Area",Rajasthan,Jaipur,"E(5) B, Road no 1C, VKI area, Jaipur - 302013",26.972289,75.777332,AC Fast Charging,EV1,24-Jul,?11 k/Wh,Wifi
Hotel Fairmont Jaipur AC Station,Rajasthan,Kukas,"Hotel Fairmont Jaipur, Riico, 2, Jaipur Engineering College Rd, Kukas, Rajasthan 302028",27.0307,75.8899,AC Fast Charging,EV1,24-Jul,?9 k/Wh,Wifi
"Yaksh The Art People, Delhi-Jaipur Highway",Rajasthan,Sayri,"Yaksh, The Art People, Delhi-Jaipur Highway, Syari, Rajasthan 303002",27.1590851,75.9603844,AC Fast Charging,EV1,24-Jul,?10 k/Wh,"No Wifi, No Parking"
"Rajshree Resort, Saladwas",Rajasthan,Jaipur,"KHASRA NO.131/1 AND 132/1, VILLAGE SALADWAS, CHANDWAJI, N.H.8 TEHSIL AMER, JAIPUR, Rajasthan - 303113",27.2377252,75.9485975,DC Fast Charging,EV2,24-Jul,?12 k/Wh,Parking
"Visvakarma Hotel, Jhunhunnu",Rajasthan,Sikar,"Visvakarma Hotel, NH 11 NH52, Near Ganpati Dham, Sargoth, Sargoth Via Reengus, Sikar Rajasthan 332404",27.3449069,75.6020031,DC Fast Charging,EV2,24-Jul,?9 k/Wh,Wifi
Statiq Charging Station,Rajasthan,Shahpura,"Hotel Highway King, Main, Delhi - Jaipur Expy, Shahpura, Rajasthan 303119",27.48694242,76.0516562,DC Fast Charging,EV2,24-Jul,?11 k/Wh,Parking
"Roshan Motors, Shahpura",Rajasthan,Shahpura,"Roshan Motors, NH-8 Neelka, district, Shahpura, Rajasthan, Pin-303119",27.4914624,76.0530077,AC Fast Charging,EV1,24-Jul,?10 k/Wh,"No Wifi, No Parking"
RnB Shanti Seva Niketan,Rajasthan,Salasar,"MDR2, Salasar , Rajasthan 332318",27.7363007,74.7426386,AC Fast Charging,EV1,24-Jul,?8 k/Wh,Wifi
Charge Zone,Rajasthan,Behror,"RJ | Behror Village | Hotel Express Highway,National Highway 8, Delhi - Jaipur Expy, Behror, Rajasthan 301701",27.857413,76.2640464,Behror Village,EV1,24-Jul,?12 k/Wh,"No Wifi, No Parking"
Highway Xpress (Jaipur-Delhi) DC charging station,Rajasthan,Behror,"Jaipur to Delhi Road, Behror Midway, Behror, Rajasthan 301701",27.8751,76.276,DC Fast Charging,EV2,24-Jul,?10 k/Wh,Parking
Highway King Behror Delhi Side DC Charging Station,Rajasthan,Gajraula,"Highway King Behror, NH 8, 3 Kms from behror towards delhi, Behror, Rajasthan 301701",27.9145,76.3146,DC Fast Charging,EV2,24-Jul,?10 k/Wh,"Wifi, Parking"
"Hotel Shemron, Neemrana",Rajasthan,Shahjahanpur,"Hotel Shemron, NH-8 Shahjahanpur, Neemrana, Shahjahanpur, Rajasthan 301706",28.0088483,76.4639783,AC Fast Charging,EV1,24-Jul,?8 k/Wh,Parking
Statiq Charging Station,Rajasthan,Alwar,"5RW6+GR Ashiana Aangan Plaza, Bhiwadi, Rajasthan 301019",28.1986644,76.81898428,DC Fast Charging,EV2,24-Jul,?12 k/Wh,Wifi
OMAXE Gurgaon Mall,Haryana,gurugram,"71, Shanti St, Block S, Uppal Southend, Sector 49, Gurugram, Haryana ",28.4109579,77.042484,AC Fast Charging,EV1,24-Jul,?9 k/Wh,"Wifi, Parking"
"Rangeet Auto, Rumtek Road",Sikkim,Gangtok,"R.P. ALLEY COMPLEX, ADAMPOOL, RUMTEK ROAD, GANGTOK, EAST SIKKIM, SIKKIM, 737135",27.305524,88.585965,DC Fast Charging,EV2,24-Jul,?12 k/Wh,"No Wifi, No Parking"
BP-OTHAKKADAI,TAMIL NADU,MADURAI,"BP Othakadai, BPCL Retail Outlet, Kodikulam Village, Madurai - Melur NH 38, Madurai 625104",9.9445,78.15418,AC Fast Charging,EV1,24-Jul,?10 k/Wh,"No Wifi, No Parking"
BP-OTHAKKADAI,TAMIL NADU,MADURAI,"BP Othakadai, BPCL Retail Outlet, Kodikulam Village, Madurai - Melur NH 38, Madurai 625104",9.9445,78.15418,AC Fast Charging,EV1,24-Jul,?10 k/Wh,"No Wifi, No Parking"
SRI RAJAN ENTERPRISES,TAMIL NADU,MADURAI,"Sri Rajan Enterprises, BPCL Dealers, Surakundu village, Melur - Madurai road, NH 38, Melur, Madurai 625106",10.02184,78.31352,AC Fast Charging,EV1,24-Jul,?9 k/Wh,"Wifi, Parking"
SRI RAJAN ENTERPRISES,TAMIL NADU,MADURAI,"Sri Rajan Enterprises, BPCL Dealers, Surakundu village, Melur - Madurai road, NH 38, Melur, Madurai 625106",10.02184,78.31352,AC Fast Charging,EV1,24-Jul,?9 k/Wh,"Wifi, Parking"
KARTHIK AGENCIES,TAMIL NADU,TRICHY,"Bharat Petroleum Dealers, S.No-456/6, 5B, NH38, CHENNAI-TRICHY HIGHWAY, SIRUGANUR, LALGUDI TK, Trichy, TN-621105",11.00462,78.78876,DC Fast Charging,EV2,24-Jul,?12 k/Wh,"No Wifi, No Parking"
KARTHIK AGENCIES,TAMIL NADU,TRICHY,"Bharat Petroleum Dealers, S.No-456/6, 5B, NH38, CHENNAI-TRICHY HIGHWAY, SIRUGANUR, LALGUDI TK, Trichy, TN-621105",11.00462,78.78876,DC Fast Charging,EV2,24-Jul,?12 k/Wh,"No Wifi, No Parking"
BP-TRICHY,TAMIL NADU,TRICHY,"Bharat Petroleum Company owner retail outlet, S.No-489/5B, NH38, CHENNAI-TRICHY HIGHWAY, SANNAMANGALAM, Trichy, TN-621104",11.03248,78.80801,DC Fast Charging,EV2,24-Jul,?11 k/Wh,"Wifi, Parking"
BP-TRICHY,TAMIL NADU,TRICHY,"Bharat Petroleum Company owner retail outlet, S.No-489/5B, NH38, CHENNAI-TRICHY HIGHWAY, SANNAMANGALAM, Trichy, TN-621104",11.03248,78.80801,DC Fast Charging,EV2,24-Jul,?11 k/Wh,"Wifi, Parking"
BP-ULUNDURPET,TAMIL NADU,KALLAKURICHI,"Bharat Petroleum Companyu00a0Owner retail outlet, Next to Ulundurpet Toll, NH38, CHENNAI-TRICHY HIGHWAY, SENGURICHI VILLAGE, KALLAKURICHI Dt, TN-606115",11.71881,79.33575,AC Fast Charging,EV1,24-Jul,?10 k/Wh,"No Wifi, No Parking"
BP-ULUNDURPET,TAMIL NADU,KALLAKURICHI,"Bharat Petroleum Company Owner retail outlet, Next to Ulundurpet Toll, NH38, CHENNAI-TRICHY HIGHWAY, SENGURICHI VILLAGE, KALLAKURICHI Dt, TN-606115",11.71881,79.33575,AC Fast Charging,EV1,24-Jul,?10 k/Wh,"No Wifi, No Parking"
RAVIE AGENCIES,TAMIL NADU,VILLUPURAM,"Bharat Petroleum Dealers, SY NO 148/1, NH38, Chennai Trichy Highway, V. SALAI, VIKRAVANDI, VILLUPURAM, TN-605652",12.06382,79.54755,AC Fast Charging,EV1,24-Jul,?9 k/Wh,"No Wifi, No Parking"
RAVIE AGENCIES,TAMIL NADU,VILLUPURAM,"Bharat Petroleum Dealers, SY NO 148/1, NH38, Chennai Trichy Highway, V. SALAI, VIKRAVANDI, VILLUPURAM, TN-605652",12.06382,79.54755,AC Fast Charging,EV1,24-Jul,?9 k/Wh,"No Wifi, No Parking"
SRI VENNI AGENCIES,TAMIL NADU,VILLUPURAM,"Bharat Petroleum Dealers, SY NO 52/6B1 & 52/7A1, NH38, Chennai Trichy Highway, CHINNAVALAVANUR, VILLUPURAM, TN-604302",12.16381,79.61146,AC Fast Charging,EV1,24-Jul,?8 k/Wh,Wifi
SRI VENNI AGENCIES,TAMIL NADU,VILLUPURAM,"Bharat Petroleum Dealers, SY NO 52/6B1 & 52/7A1, NH38, Chennai Trichy Highway, CHINNAVALAVANUR, VILLUPURAM, TN-604302",12.16381,79.61146,AC Fast Charging,EV1,24-Jul,?8 k/Wh,Wifi
SAKTHI MADUMALAR AGENCIES,TAMIL NADU,CHENGALPATTU,"SAKTHI MADHUMALAR AGENCIES, NH-45 CHENNAI-TRICHY HIGHWAY, MELMARUVATHUR, CHENGALPATTU, TAMIL NADU, 603319",12.43395,79.83235,AC Fast Charging,EV1,24-Jul,?10 k/Wh,"No Wifi, No Parking"
SAKTHI MADUMALAR AGENCIES,TAMIL NADU,CHENGALPATTU,"SAKTHI MADHUMALAR AGENCIES, NH-45 CHENNAI-TRICHY HIGHWAY, MELMARUVATHUR, CHENGALPATTU, TAMIL NADU, 603319",12.43395,79.83235,AC Fast Charging,EV1,24-Jul,?10 k/Wh,"No Wifi, No Parking"
"BP,GHAR-MARAIMALAI NAGAR",TAMIL NADU,CHENGALPATTU,"BP,GHAR-MARAIMALAI NAGAR, SY NO 336/6 ( PART ), NH-45, GST RO, MARAIMALAI NAGAR, CHENGALPATTU, TAMILNADU, 603209",12.78326,80.01671,AC Fast Charging,EV1,24-Jul,?10 k/Wh,"No Wifi, No Parking"
"BP,GHAR-MARAIMALAI NAGAR",TAMIL NADU,CHENGALPATTU,"BP,GHAR-MARAIMALAI NAGAR, SY NO 336/6 ( PART ), NH-45, GST RO, MARAIMALAI NAGAR, CHENGALPATTU, TAMILNADU, 603209",12.78326,80.01671,AC Fast Charging,EV1,24-Jul,?10 k/Wh,"No Wifi, No Parking"
A S M ABDUL CADER AND CO,TAMIL NADU,CHENNAI,"A S M ABDUL CADER AND CO, DOOR NO 355 CEMENT ROAD, ALANDUR, MEENAMBAKKAM,CHENNAI, TAMIL NADU, 600016",12.99431,80.18706,AC Fast Charging,EV1,24-Jul,?8 k/Wh,"No Wifi, No Parking"
A S M ABDUL CADER AND CO,TAMIL NADU,CHENNAI,"A S M ABDUL CADER AND CO, DOOR NO 355 CEMENT ROAD, ALANDUR, MEENAMBAKKAM,CHENNAI, TAMIL NADU, 600016",12.99431,80.18706,AC Fast Charging,EV1,24-Jul,?8 k/Wh,"No Wifi, No Parking"
HMR MADHAPUR,TELENGANA,HYDERABAD,"PLOT NO 735 ROAD NO 37 AND 38LEFT LANE AFTER CROMA,CBI COLONY JUBLI HILLS,HYDERABAD.TELENGANA 500033",17.435968,78.40003,DC Fast Charging,EV2,24-Jul,?15 k/Wh,"Wifi, Parking"
HMR BEGUMPET,TELENGANA,HYDERABAD,"7-1-22/A Begumpet flyover, Leelanagar, Ameerpet, Telanagana 500016",17.438229,78.457263,DC Fast Charging,EV2,24-Jul,?15 k/Wh,"Wifi, Parking"
IOC BEGUMPET,TELENGANA,HYDERABAD,"BEGUMPET,HYDERABAD,TELENGANA,INDIA,TELENGANA,500016,HYDERABAD",17.444838,78.466949,AC Fast Charging,EV1,24-Jul,?12 k/Wh,"No Wifi, No Parking"
IOC MADINAGUDA,TELENGANA,HYDERABAD,"SURVEY NO 98 MIYAPUR MAIN ROAD,MADINAGUDA HAFEEZPET,TELENGANA 500050 HYDERABAD",17.494851,78.336467,AC Fast Charging,EV1,24-Jul,?12 k/Wh,"No Wifi, No Parking"
MG HYDERABAD JUBILEE HILLS,TELENGANA,HYDERABAD,"8-2-120/86, 10A, opposite Hotel park hyatt, Rd no2, Banjara hills, hyderabad, 500033",17.523923,78.430328,DC Fast Charging,EV2,24-Jul,?18 k/Wh,"Wifi, Parking"
KB's Woodlands,Maharashtra,pune,"B J Road Railway Station, Sadhu Vaswani Rd, near Pune, Maharashtra,Sadhu Vaswani Chowk",18.525182,73.8758609,AC Fast Charging,EV1,24-Jul,?10 k/Wh,"Wifi, Parking"
"Ather Space, Kollam",Kerala,kollam,"Raj Plaza Building, Kilikkolloor P.O, Kollam ",8.899214117,76.61299674,AC Fast Charging,EV1,24-Jul,?12 k/Wh,"Wifi, Parking"
Cassia Restaurant I Alappuzha,Kerala,Alappuzha,"Cassia Restaurant, NH -47, Kommady, Alappuzha, Kerala 688008",9.5188743,76.3274171,AC Fast Charging,EV1,24-Jul,?10 k/Wh,Parking
Hotel Temple City I Thirumangalam,Tamil Nadu,Thirumangalam,"Hotel Temple City, NH 44, Madurai to Virudhunagar Highways Melanesaneri Sivarakottaim, Madurai, Tamil Nadu 625706",9.7590386,77.9791582,AC Fast Charging,EV1,24-Jul,?9 k/Wh,Wifi
"PPS Motors, Thirumangalam",Tamil Nadu,Madurai,"Shed No. D-23, Nilaiyur First Bit, Uchapatti Village,Thirumangalam, Madurai-625402",9.862428,78.021557,DC Fast Charging,EV2,24-Jul,?10 k/Wh,"Wifi, Parking"
"Chima Cars, Kappalur",Tamil Nadu,Madurai,"H-14, H-14A, SIDCO INDUSTRIAL ESTATE UCCHAPATTI, Kappalur, Tamil Nadu 625008",9.938364,78.150085,DC Fast Charging,EV2,24-Jul,?8 k/Wh,"Wifi, Parking"
"Kaveri Auto Garage, Paravai Bit 1 village",Tamil Nadu,Madurai,"New Survey No 146/2C,148/1A,149/1B2A, Paravai Bit 1 village, Madurai, 625402",9.9642326,78.0650107,AC Fast Charging,EV1,24-Jul,?9 k/Wh,"No Wifi, Parking"
Centre square mall,Kerala,kochi,"40/6972, Mahatma Gandhi Rd, Rajaji Junction, Kochi, Kerala ",9.9779338,76.2808706,DC Fast Charging,EV2,24-Jul,?12 k/Wh,"Wifi, Parking"
Hotel Temple City Lake (Inn KSN Charging Station),Tamil Nadu,Madurai,"Trichy - Madurai Highway, Valaichcherippatti, Tamil Nadu - 625104",9.987081053,78.24154444,AC Fast Charging,EV1,24-Jul,?7 k/Wh,"Wifi, Parking"
Hotel Kodai International,Tamil Nadu,Kodaikanal,"17/328, Laws Ghat Rd, Kodaikanal, Tamil Nadu 624101",10.2428087,77.4983634,AC Fast Charging,EV1,24-Jul,?6 k/Wh,"Wifi, Parking"
"Kaveri Auto Garage, Seelapadi",Tamil Nadu,Dindigul,"478/1A2, Trichy Bypass, Seelapadi, Dindigul, Tamil Nadu, 624005",10.3811273,77.99681425,DC Fast Charging,EV2,24-Jul,?10 k/Wh,"Wifi, Parking"
Ganpat Grand I Palani,Tamil Nadu,Palani,"Circle, 167/1, Adivaram Itteri Road Near Balaji Bhavan, Palani, Tamil Nadu 624601",10.4425816,77.5203903,AC Fast Charging,EV1,24-Jul,?9 k/Wh,"Wifi, Parking"
Adyar Ananda Bhavan I Navakkarai,Tamil Nadu,Walayar,"Adyar Ananda Bhavan Restaurant, 285, Palakkad Main Rd, MahendraMedu, Navakarai, Coimbatore, Tamil Nadu 641105",10.8559461,76.8625309,DC Fast Charging,EV2,24-Jul,?11 k/Wh,"No Wifi, Parking"
"Ather Space, Tirur",Kerala,tirur,"Pookkayil, Tirur, Kerala ",10.9235812,75.9131205,DC Fast Charging,EV2,24-Jul,?12 k/Wh,"Wifi, Parking"
Hotel Subbanna | Karur,Tamil Nadu,Karur,"Madurai Byepass Road Service Road, L G B Nagar, Tamil Nadu 639001",10.9577783,78.0605855,AC Fast Charging,EV1,24-Jul,?8 k/Wh,"Wifi, Parking"
"Sulaimani Club, Kottakkal",Tkerala,malappuram,"XXMX+J2F, Palathara, Kerala ",10.98413151,75.99785911,DC Fast Charging,EV2,24-Jul,?10 k/Wh,"Wifi, Parking"
Richy Rich - Race course,Tamil Nadu,coimbatore,"Race Course Rd, Near Park, Race Course, Coimbatore, Tamil Nadu ",10.9984009,76.9765316,AC Fast Charging,EV1,24-Jul,?9 k/Wh,"Wifi, Parking"
"IOCL Shanthi Social Services, Singanallur",Tamil Nadu,Coimbatore,"128, 2247, Trichy Rd, Krishnapuram Medu, Singanallur, Tamil Nadu 641005",11.00269216,77.0387079,DC Fast Charging,EV2,24-Jul,?10 k/Wh,"Wifi, Parking"
BROOKFIELDS MALL ,Tamil Nadu,COIMBATORE,"Dr Krishnasamy Mudaliyar Rd, Brookefields, Sukrawar Pettai, R S Puram West, Coimbatore, Tamil Nadu 641001",11.008935,76.95954,AC Fast Charging,EV1,24-Jul,?8 k/Wh,"Wifi, Parking"
VEEV Brookfields,Tamil Nadu,Coimbatore,"67-71, Dr Krishnasamy Mudaliyar Rd, Ram Nagar, Coimbatore, Tamil Nadu 641001",11.0096,76.9589,DC Fast Charging,EV2,24-Jul,?9 k/Wh,"Wifi, Parking"
"SR Tranzcars, Saibaba Koil",Tamil Nadu,Coimbatore,"1142-A, Mettupalayam Rd, Saibaba Koil, Coimbatore, Tamil Nadu 641043",11.022849,76.951635,DC Fast Charging,EV2,24-Jul,?12 k/Wh,"Wifi, Parking"
"PPS Motors, Chinniyampalayam",Tamil Nadu,Coimbatore,"No-138, Avinashi Road, Chinniyampalayam, Coimbatore-641062",11.04991,77.05765,AC Fast Charging,EV1,24-Jul,?10 k/Wh,"Wifi, Parking"
Mugs And Brews - Cafu00e9 Restaurant,Tamil Nadu,coimbatore,"23A Thudiyalur Road Sivasakthi Nagar, Saravanampatti",11.0809942,76.9911489,DC Fast Charging,EV2,24-Jul,?11 k/Wh,"No Wifi, Parking"
SREE ANNAPOORNA HOTEL,Tamil Nadu,AVINASHI,"NH544,AVINASHI BYE PASS ROAD,AVINASHI,TAMILNADU 641654",11.175093,77.263374,AC Fast Charging,EV1,24-Jul,?7 k/Wh,"Wifi, Parking"
Hotel Sangeetha (Duriyam Charging Station),Tamil Nadu,Namakkal,"NH 44, Namakkal - Karur Tollgate, Tamil Nadu - 637207",11.19362344,78.10483415,AC Fast Charging,EV1,24-Jul,?8 k/Wh,"Wifi, Parking"
Aswins Veg Restaurant,Tamil Nadu,Perambalur,"NH 45, Kalpady Road, Eraiyasamuthiram, Perambalur, Tamil Nadu 621113",11.2064644,78.8812406,DC Fast Charging,EV2,24-Jul,?9 k/Wh,"No Wifi, Parking"
"IOCL COCO Chengampalli, Salem-Kochi Highway",Tamil Nadu,Chengampalli,"Salem - Kochi Hwy, Vadamugam Kangayapalayam, Tamil Nadu 638812",11.213022,77.441968,AC Fast Charging,EV1,24-Jul,?10 k/Wh,"Wifi, Parking"
Dr. Cafe,Kerala,calicut,"Kozhikode - Mavoor - Areacode Rd, Near Hindustan Petroleum, Velliparamba, Kozhikode, Kerala ",11.2698057,75.8436455,DC Fast Charging,EV2,24-Jul,?12 k/Wh,"Wifi, Parking"
RMS Towers (Ero_G Electric Charging Station),Tamil Nadu,Erode,"NH544, Kovai to Salem Road, Solipalayam, ",11.30199446,77.60004376,DC Fast Charging,EV2,24-Jul,?9 k/Wh,"No Wifi, Parking"
VEEV A2B Kallar,Tamil Nadu,Mettupalayam,"A2B, Kallar Road, Mettupalayam, Tamil Nadu",11.3217,76.9163,DC Fast Charging,EV2,24-Jul,?11 k/Wh,"Wifi, Parking"
VEEV Sathya Nursery,Tamil Nadu,Mettupalayam,"Kallar, Mettupalayam, Tamil Nadu",11.33,76.9027,AC Fast Charging,EV1,24-Jul,?8 k/Wh,"No Wifi, Parking"
"Gateway Coonoor - IHCL SeleQtions, Coonoor",Tamil Nadu,Ooty,"Upper, Coonoor, Tamil Nadu 643101",11.3459974,76.801575,AC Fast Charging,EV1,24-Jul,?9 k/Wh,"Wifi, Parking"
Relux Charging Station,Tamil Nadu,Chidambaram,"Chidambaram Bypass Bridge, Kannangudi, Chidambaram, Tamil Nadu 608602",11.40846847,79.67437527,DC Fast Charging,EV2,24-Jul,?10 k/Wh,"Wifi, Parking"
Hotel Gem Park,Tamil Nadu,Ooty,"Sheddon Road, Pudumund Ooty Tamilnadu 643001",11.42,76.7,AC Fast Charging,EV1,24-Jul,?8 k/Wh,"Wifi, Parking"
Adyar Ananda Bhavan I Rasipuram,Tamil Nadu,Rasipuram,"Adyar Ananda Bhavan Restaurant, NH44, Brindavan Garden, Salem-Madurai Rd, Athanur, Tamil Nadu 637401",11.4922712,78.1535774,AC Fast Charging,EV1,24-Jul,?10 k/Wh,"Wifi, Parking"
SHREE SARAVANA BHAVAN,Tamil Nadu,SANKAGIRI,"Near Sankagiri Toll Gate, NH-47 Salem-Kanyakumari Hwy, Vaikundam, Sankari, Tamil Nadu 637103",11.519342,77.935042,DC Fast Charging,EV2,24-Jul,?12 k/Wh,Wifi
ADYAR ANANDA BHAVAN,Tamil Nadu,ATTUR,"NH9,Thulakanoor Village,Salem District,Attur,TamilNadu",11.591985,78.627219,AC Fast Charging,EV1,24-Jul,?10 k/Wh,"No Wifi, No Parking"
"True Sai Motors, Narasothipatti",Tamil Nadu,Salem,"No 73 Salem, Omalur Highway, next to Hotel Grand Estancia, Narasothipatti, Salem, Tamil Nadu 636004,636001",11.682985,78.1260402,DC Fast Charging,EV2,24-Jul,?8 k/Wh,Parking
Cafe Udupi Ruchi,Tamil Nadu,Ulundurpet,"102/19, Chennai Trichy NH Sengurichi, Village, Ulundurpet, Tamil Nadu 606115",11.7194357,79.3364597,AC Fast Charging,EV1,24-Jul,?11 k/Wh,"Wifi, Parking"
CafeUdupi Ruchi,Tamil Nadu,Ulundurpet,"102/19, Chennai Trichy NH Sengurichi, Village, Ulundurpet, Tamil Nadu 606115",11.7194357,79.3364597,AC Fast Charging,EV1,24-Jul,?11 k/Wh,"Wifi, Parking"
Aasai Aasai Anandha Bhavan | Omalur,Tamil Nadu,Omalur,"Aasai Aasai Anandha Bhavan Delight, A/C Pure Veg Restaurant, NH - 44, Bangalore, to, Salem Highway, Omalur, Tamil Nadu 636455",11.7592238,78.4273441,AC Fast Charging,EV1,24-Jul,?10 k/Wh,Parking
"IOCL COCO Palayamputhur, Palyampudur",Tamil Nadu,Palyampudur,"Dharmapuri Main Road, Palayampudur, Tamil Nadu 636807",12.0243727,78.0979115,DC Fast Charging,EV2,24-Jul,?9 k/Wh,"No Wifi, No Parking"
"Ocean Spray Resort, Manjakuppam",Tamil Nadu,Pondicherry,"No: 7, 8, 9, SH 49, Manjakuppam, Tamil Nadu 60430",12.06587465,79.88027083,AC Fast Charging,EV1,24-Jul,?10 k/Wh,"Wifi, Parking"
Ammayii Hotel & Resorts (PKS Charging Station),Tamil Nadu,Tiruvannamalai,"Old No: 80, New No: 40, Sannathi Street, Opp Karur Vysya Bank, Thiruvanamalai, Tamil Nadu - 606601",12.23639376,79.08960088,DC Fast Charging,EV2,24-Jul,?12 k/Wh,Parking
Hotel Aishwarya Bhavan (Safa Electric),Tamil Nadu,Villupuram,"Chennai - Trichy Highway, Tindivanam, Tamil Nadu - 604001",12.24034498,79.66228159,AC Fast Charging,EV1,24-Jul,?11 k/Wh,Wifi
ADAYAR ANANDA BHAVAN,Tamil Nadu,THINDIVANAM,"Swastiks enterpreneurs,NH45,Chennai-Trichy highway,NallathurThindivanam,Tamilnadu 604307",12.297694,79.73365,AC Fast Charging,EV1,24-Jul,?10 k/Wh,"Wifi, Parking"
"True Sai Motors, Avaragere",Tamil Nadu,Krishnagiri,"No 417A/1A Krishnagiri Chennai Highway, Pethanapalli, opposite to Hotel, Krishnagiri, Tamil Nadu 635001",12.5306064,78.2375165,DC Fast Charging,EV2,24-Jul,?9 k/Wh,Parking
Alps Residency - A Bergamont Group of Hotel-,Tamil Nadu,Krishnagiri,"Bangalore Bye Pass Road Near Toll Plaza, Krishnagiri, Tamil Nadu-635001",12.54250304,78.20153274,AC Fast Charging,EV1,24-Jul,?10 k/Wh,"Wifi, Parking"
HOTEL SURYA COMPLEX,Tamil Nadu,KRISHNAGIRI,"NH44,Bangalore Highway,Pollupalli,Krishnagiri,TamilNadu 635115",12.582141,78.157101,DC Fast Charging,EV2,24-Jul,?11 k/Wh,Parking
"Hotel Mamalla Heritage, Fisherman Colony",Tamil Nadu,Mahabalipuram,"104 east raja street, Mahabalipuram, Tamil Nadu 603104",12.61860448,80.19400597,AC Fast Charging,EV1,24-Jul,?10 k/Wh,"Wifi, Parking"
Radisson Blu Resort Temple Bay I Mamallapuram,Tamil Nadu,Mahabalipuram,"Radisson Blu Resort Temple Bay Mamallapuram, 57 Covelong Road, Dist, Mahabalipuram, Tamil Nadu 603104",12.6238399,80.1945931,DC Fast Charging,EV2,24-Jul,?12 k/Wh,"Wifi, Parking"
"Motel Mamalla, SH 49",Tamil Nadu,Mahabalipuram,"Motel Mamalla No.77, East Coast Road, SH 49, Mahabalipuram, Tamil Nadu 603104",12.6325138,80.1958391,AC Fast Charging,EV1,24-Jul,?10 k/Wh,"Wifi, Parking"
D square Mall,Tamil Nadu,Shoolagiri,"Dhiviyam Square Food Court, NH - 7 Hosur - Krishnagiri Highway, Sundagiri, Shool, Tamil Nadu 635117",12.6462747,78.0470111,DC Fast Charging,EV2,24-Jul,?11 k/Wh,Parking
Tata Power ,Tamil Nadu,Hosur,"True Sai, Agraharam, Survey No 46/ 1A and 47/1A Thorapalli Agraharam, Hosur, Tamil Nadu 635109",12.7170751,77.876026,AC Fast Charging,EV1,24-Jul,?9 k/Wh,Parking
"Fairfield by Marriott, Mahindra World City",Tamil Nadu,Chennai,"Near Main Entrance, Mahindra World City, Chennai - 603002",12.730596,80.00463,DC Fast Charging,EV2,24-Jul,?12 k/Wh,"Wifi, Parking"
RR Charging Station (RR Charging Station),Tamil Nadu,Ambur,"No: 19,IELC Complex, MC Road, Ambur, Tamil Nadu - 635802",12.77988445,78.71776971,AC Fast Charging,EV1,24-Jul,?10 k/Wh,"Wifi, Parking"
Darshan super market,Tamil Nadu,chennai,"Chitrakoot Complex,No.91/18A,OMR,Egattur opp to Flsmidth,Chennai-603103,Chengalpattu, District, Chennai, Tamil Nadu ",12.8291702,80.2298531,DC Fast Charging,EV2,24-Jul,?9 k/Wh,"No Wifi, No Parking"
Hotel Kalyan Grand I Vandalur,Tamil Nadu,"Vandalur, Chennai","Kalyan Grand - a business hotel, 247 Grand Southern Trunk Rd, Next to Vandalur Zoo, Chennai, Tamil Nadu 600048",12.8735113,80.0785537,DC Fast Charging,EV2,24-Jul,?12 k/Wh,"Wifi, Parking"
"Four Points by Sheraton, Chennai OMR",Tamil Nadu,Chennai,"Survey No 169, Plot 1B and 1A, Rajiv Gandhi Salai, Kumaran Nagar, Sholinganallur, Chennai-600119,Four Points 1, Semmancheri, Chennai, Tamil Nadu 600119",12.875613,80.227372,AC Fast Charging,EV1,24-Jul,?10 k/Wh,"Wifi, Parking"
IOCL AB Enterprises,Tamil Nadu,Chennai,"Old Mahabalipuram Rd, Semmancheri, Chennai, Tamil Nadu 600119",12.87627,80.22709415,DC Fast Charging,EV2,24-Jul,?11 k/Wh,"No Wifi, No Parking"
Sri Durga Bhavan Elite (Devika Yogaraajan Charging Station),Tamil Nadu,Vellore,"Near HP Petrol Pump, Pallikonda, Tamil Nadu, 635809",12.9023796,78.93386744,AC Fast Charging,EV1,24-Jul,?10 k/Wh,"Wifi, Parking"
Hotel Aryaas Veg | Pallikonda,Tamil Nadu,Pallikonda,"HOTEL ARYAAS, NH-4, Veppangal, Pallikonda, Tamil Nadu 635809",12.9071309,78.9620183,DC Fast Charging,EV2,24-Jul,?9 k/Wh,"Wifi, Parking"
Smarttron Automations,Karnataka,bengaluru,"4th Floor, 1031, 24th Main Rd, 1st Sector, HSR Layout, Bengaluru",12.917819,77.64921,AC Fast Charging,EV1,24-Jul,?10 k/Wh,"Wifi, Parking"
"LAKSHMI Motors, Thoraipakkam",Tamil Nadu,Chennai,"118, Okkiam, Thoraipakkam, Chennai, Tamil Nadu - 600097",12.92976,80.23164,DC Fast Charging,EV2,24-Jul,?11 k/Wh,"No Wifi, No Parking"
"FPL Vehicles, Perumugai",Tamil Nadu,Vellore,"33/5A1, Chennai Bangalore Highway, perumugai, Vellore-632009",12.945336,79.200662,AC Fast Charging,EV1,24-Jul,?10 k/Wh,"Wifi, Parking"
